timestamp,source_ip,target_ip,source_port,target_port,packet_size,attack_mode,label,packet_length,packet_summary
2024-04-20T20:24:24.995035,192.168.1.100,192.168.31.185,38723,100,60,http,normal,80,IP / TCP 192.168.1.100:38723 > 192.168.31.185:http PA / Raw
2024-04-20T20:24:25.000022,192.168.1.100,192.168.31.185,33173,100,60,http,normal,80,IP / TCP 192.168.1.100:33173 > 192.168.31.185:http PA / Raw
2024-04-20T20:24:25.005009,192.168.1.100,192.168.31.185,5004,100,60,http,normal,80,IP / TCP 192.168.1.100:5004 > 192.168.31.185:http PA / Raw
2024-04-20T20:24:25.011066,192.168.1.100,192.168.31.185,49786,100,60,http,normal,80,IP / TCP 192.168.1.100:49786 > 192.168.31.185:http PA / Raw
2024-04-20T20:24:25.015321,192.168.1.100,192.168.31.185,54438,100,60,http,normal,80,IP / TCP 192.168.1.100:54438 > 192.168.31.185:http PA / Raw
2024-04-20T20:24:25.020310,192.168.1.100,192.168.31.185,20484,100,60,http,normal,80,IP / TCP 192.168.1.100:20484 > 192.168.31.185:http PA / Raw
2024-04-20T20:24:25.024299,192.168.1.100,192.168.31.185,13243,100,60,http,normal,80,IP / TCP 192.168.1.100:13243 > 192.168.31.185:http PA / Raw
2024-04-20T20:24:25.028914,192.168.1.100,192.168.31.185,4743,100,60,http,normal,80,IP / TCP 192.168.1.100:4743 > 192.168.31.185:http PA / Raw
2024-04-20T20:24:25.033872,192.168.1.100,192.168.31.185,8543,100,60,http,normal,80,IP / TCP 192.168.1.100:8543 > 192.168.31.185:http PA / Raw
2024-04-20T20:24:25.037889,192.168.1.100,192.168.31.185,9122,100,60,http,normal,80,IP / TCP 192.168.1.100:9122 > 192.168.31.185:http PA / Raw
2024-04-20T20:24:25.042849,192.168.1.100,192.168.31.185,27939,100,60,http,normal,80,IP / TCP 192.168.1.100:27939 > 192.168.31.185:http PA / Raw
2024-04-20T20:24:25.046863,192.168.1.100,192.168.31.185,13769,100,60,http,normal,80,IP / TCP 192.168.1.100:13769 > 192.168.31.185:http PA / Raw
2024-04-20T20:24:25.050857,192.168.1.100,192.168.31.185,6634,100,60,http,normal,80,IP / TCP 192.168.1.100:6634 > 192.168.31.185:http PA / Raw
2024-04-20T20:24:25.055813,192.168.1.100,192.168.31.185,56179,100,60,http,normal,80,IP / TCP 192.168.1.100:56179 > 192.168.31.185:http PA / Raw
2024-04-20T20:24:25.059832,192.168.1.100,192.168.31.185,53867,100,60,http,normal,80,IP / TCP 192.168.1.100:53867 > 192.168.31.185:http PA / Raw
2024-04-20T20:24:25.064789,192.168.1.100,192.168.31.185,45490,100,60,http,normal,80,IP / TCP 192.168.1.100:45490 > 192.168.31.185:http PA / Raw
2024-04-20T20:24:25.069776,192.168.1.100,192.168.31.185,5984,100,60,http,normal,80,IP / TCP 192.168.1.100:5984 > 192.168.31.185:http PA / Raw
2024-04-20T20:24:25.074375,192.168.1.100,192.168.31.185,56205,100,60,http,normal,80,IP / TCP 192.168.1.100:56205 > 192.168.31.185:http PA / Raw
2024-04-20T20:24:25.080359,192.168.1.100,192.168.31.185,60564,100,60,http,normal,80,IP / TCP 192.168.1.100:60564 > 192.168.31.185:http PA / Raw
2024-04-20T20:24:25.084351,192.168.1.100,192.168.31.185,32428,100,60,http,normal,80,IP / TCP 192.168.1.100:32428 > 192.168.31.185:http PA / Raw
2024-04-20T20:24:25.089337,192.168.1.100,192.168.31.185,1379,100,60,http,normal,80,IP / TCP 192.168.1.100:1379 > 192.168.31.185:http PA / Raw
2024-04-20T20:24:25.093326,192.168.1.100,192.168.31.185,54730,100,60,http,normal,80,IP / TCP 192.168.1.100:54730 > 192.168.31.185:http PA / Raw
2024-04-20T20:24:25.098313,192.168.1.100,192.168.31.185,11403,100,60,http,normal,80,IP / TCP 192.168.1.100:11403 > 192.168.31.185:http PA / Raw
2024-04-20T20:24:25.102302,192.168.1.100,192.168.31.185,36420,100,60,http,normal,80,IP / TCP 192.168.1.100:36420 > 192.168.31.185:http PA / Raw
2024-04-20T20:24:25.107289,192.168.1.100,192.168.31.185,15362,100,60,http,normal,80,IP / TCP 192.168.1.100:15362 > 192.168.31.185:http PA / Raw
2024-04-20T20:24:25.112275,192.168.1.100,192.168.31.185,46210,100,60,http,normal,80,IP / TCP 192.168.1.100:46210 > 192.168.31.185:http PA / Raw
2024-04-20T20:24:25.117262,192.168.1.100,192.168.31.185,20233,100,60,http,normal,80,IP / TCP 192.168.1.100:20233 > 192.168.31.185:http PA / Raw
2024-04-20T20:24:25.123246,192.168.1.100,192.168.31.185,61909,100,60,http,normal,80,IP / TCP 192.168.1.100:61909 > 192.168.31.185:http PA / Raw
2024-04-20T20:24:25.129230,192.168.1.100,192.168.31.185,19974,100,60,http,normal,80,IP / TCP 192.168.1.100:19974 > 192.168.31.185:http PA / Raw
2024-04-20T20:24:25.134217,192.168.1.100,192.168.31.185,4490,100,60,http,normal,80,IP / TCP 192.168.1.100:4490 > 192.168.31.185:http PA / Raw
2024-04-20T20:24:25.138672,192.168.1.100,192.168.31.185,42032,100,60,http,normal,80,IP / TCP 192.168.1.100:42032 > 192.168.31.185:http PA / Raw
2024-04-20T20:24:25.143658,192.168.1.100,192.168.31.185,41329,100,60,http,normal,80,IP / TCP 192.168.1.100:41329 > 192.168.31.185:http PA / Raw
2024-04-20T20:24:25.147648,192.168.1.100,192.168.31.185,8613,100,60,http,normal,80,IP / TCP 192.168.1.100:8613 > 192.168.31.185:http PA / Raw
2024-04-20T20:24:25.152634,192.168.1.100,192.168.31.185,34482,100,60,http,normal,80,IP / TCP 192.168.1.100:34482 > 192.168.31.185:http PA / Raw
2024-04-20T20:24:25.156153,192.168.1.100,192.168.31.185,5611,100,60,http,normal,80,IP / TCP 192.168.1.100:5611 > 192.168.31.185:http PA / Raw
2024-04-20T20:24:25.161143,192.168.1.100,192.168.31.185,27929,100,60,http,normal,80,IP / TCP 192.168.1.100:27929 > 192.168.31.185:http PA / Raw
2024-04-20T20:24:25.166129,192.168.1.100,192.168.31.185,61482,100,60,http,normal,80,IP / TCP 192.168.1.100:61482 > 192.168.31.185:http PA / Raw
2024-04-20T20:24:25.170562,192.168.1.100,192.168.31.185,6279,100,60,http,normal,80,IP / TCP 192.168.1.100:6279 > 192.168.31.185:http PA / Raw
2024-04-20T20:24:25.174552,192.168.1.100,192.168.31.185,59900,100,60,http,normal,80,IP / TCP 192.168.1.100:59900 > 192.168.31.185:http PA / Raw
2024-04-20T20:24:25.178541,192.168.1.100,192.168.31.185,11253,100,60,http,normal,80,IP / TCP 192.168.1.100:11253 > 192.168.31.185:http PA / Raw
2024-04-20T20:24:25.183527,192.168.1.100,192.168.31.185,25066,100,60,http,normal,80,IP / TCP 192.168.1.100:25066 > 192.168.31.185:http PA / Raw
2024-04-20T20:24:25.188514,192.168.1.100,192.168.31.185,35919,100,60,http,normal,80,IP / TCP 192.168.1.100:35919 > 192.168.31.185:http PA / Raw
2024-04-20T20:24:25.192504,192.168.1.100,192.168.31.185,8654,100,60,http,normal,80,IP / TCP 192.168.1.100:8654 > 192.168.31.185:http PA / Raw
2024-04-20T20:24:25.197490,192.168.1.100,192.168.31.185,28554,100,60,http,normal,80,IP / TCP 192.168.1.100:28554 > 192.168.31.185:http PA / Raw
2024-04-20T20:24:25.202476,192.168.1.100,192.168.31.185,21855,100,60,http,normal,80,IP / TCP 192.168.1.100:21855 > 192.168.31.185:http PA / Raw
2024-04-20T20:24:25.208670,192.168.1.100,192.168.31.185,64230,100,60,http,normal,80,IP / TCP 192.168.1.100:64230 > 192.168.31.185:http PA / Raw
2024-04-20T20:24:25.213656,192.168.1.100,192.168.31.185,60420,100,60,http,normal,80,IP / TCP 192.168.1.100:60420 > 192.168.31.185:http PA / Raw
2024-04-20T20:24:25.218643,192.168.1.100,192.168.31.185,6563,100,60,http,normal,80,IP / TCP 192.168.1.100:6563 > 192.168.31.185:http PA / Raw
2024-04-20T20:24:25.223630,192.168.1.100,192.168.31.185,23393,100,60,http,normal,80,IP / TCP 192.168.1.100:23393 > 192.168.31.185:http PA / Raw
2024-04-20T20:24:25.228616,192.168.1.100,192.168.31.185,43507,100,60,http,normal,80,IP / TCP 192.168.1.100:43507 > 192.168.31.185:http PA / Raw
2024-04-20T20:24:25.233602,192.168.1.100,192.168.31.185,28437,100,60,http,normal,80,IP / TCP 192.168.1.100:28437 > 192.168.31.185:http PA / Raw
2024-04-20T20:24:25.238590,192.168.1.100,192.168.31.185,15506,100,60,http,normal,80,IP / TCP 192.168.1.100:15506 > 192.168.31.185:http PA / Raw
2024-04-20T20:24:25.243576,192.168.1.100,192.168.31.185,6579,100,60,http,normal,80,IP / TCP 192.168.1.100:6579 > 192.168.31.185:http PA / Raw
2024-04-20T20:24:25.249561,192.168.1.100,192.168.31.185,5109,100,60,http,normal,80,IP / TCP 192.168.1.100:5109 > 192.168.31.185:http PA / Raw
2024-04-20T20:24:25.254547,192.168.1.100,192.168.31.185,22229,100,60,http,normal,80,IP / TCP 192.168.1.100:22229 > 192.168.31.185:http PA / Raw
2024-04-20T20:24:25.259533,192.168.1.100,192.168.31.185,38090,100,60,http,normal,80,IP / TCP 192.168.1.100:38090 > 192.168.31.185:http PA / Raw
2024-04-20T20:24:25.264520,192.168.1.100,192.168.31.185,22497,100,60,http,normal,80,IP / TCP 192.168.1.100:22497 > 192.168.31.185:http PA / Raw
2024-04-20T20:24:25.269507,192.168.1.100,192.168.31.185,50920,100,60,http,normal,80,IP / TCP 192.168.1.100:50920 > 192.168.31.185:http PA / Raw
2024-04-20T20:24:25.274493,192.168.1.100,192.168.31.185,33840,100,60,http,normal,80,IP / TCP 192.168.1.100:33840 > 192.168.31.185:http PA / Raw
2024-04-20T20:24:25.279430,192.168.1.100,192.168.31.185,65260,100,60,http,normal,80,IP / TCP 192.168.1.100:65260 > 192.168.31.185:http PA / Raw
2024-04-20T20:24:25.284392,192.168.1.100,192.168.31.185,11735,100,60,http,normal,80,IP / TCP 192.168.1.100:11735 > 192.168.31.185:http PA / Raw
2024-04-20T20:24:25.288381,192.168.1.100,192.168.31.185,45821,100,60,http,normal,80,IP / TCP 192.168.1.100:45821 > 192.168.31.185:http PA / Raw
2024-04-20T20:24:25.292371,192.168.1.100,192.168.31.185,25618,100,60,http,normal,80,IP / TCP 192.168.1.100:25618 > 192.168.31.185:http PA / Raw
2024-04-20T20:24:25.296710,192.168.1.100,192.168.31.185,39240,100,60,http,normal,80,IP / TCP 192.168.1.100:39240 > 192.168.31.185:http PA / Raw
2024-04-20T20:24:25.300699,192.168.1.100,192.168.31.185,27849,100,60,http,normal,80,IP / TCP 192.168.1.100:27849 > 192.168.31.185:http PA / Raw
2024-04-20T20:24:25.305686,192.168.1.100,192.168.31.185,32823,100,60,http,normal,80,IP / TCP 192.168.1.100:32823 > 192.168.31.185:http PA / Raw
2024-04-20T20:24:25.310673,192.168.1.100,192.168.31.185,62863,100,60,http,normal,80,IP / TCP 192.168.1.100:62863 > 192.168.31.185:http PA / Raw
2024-04-20T20:24:25.314662,192.168.1.100,192.168.31.185,51833,100,60,http,normal,80,IP / TCP 192.168.1.100:51833 > 192.168.31.185:http PA / Raw
2024-04-20T20:24:25.318652,192.168.1.100,192.168.31.185,13469,100,60,http,normal,80,IP / TCP 192.168.1.100:13469 > 192.168.31.185:http PA / Raw
2024-04-20T20:24:25.323638,192.168.1.100,192.168.31.185,64210,100,60,http,normal,80,IP / TCP 192.168.1.100:64210 > 192.168.31.185:http PA / Raw
2024-04-20T20:24:25.327627,192.168.1.100,192.168.31.185,13770,100,60,http,normal,80,IP / TCP 192.168.1.100:13770 > 192.168.31.185:http PA / Raw
2024-04-20T20:24:25.331616,192.168.1.100,192.168.31.185,64721,100,60,http,normal,80,IP / TCP 192.168.1.100:64721 > 192.168.31.185:http PA / Raw
2024-04-20T20:24:25.336603,192.168.1.100,192.168.31.185,32794,100,60,http,normal,80,IP / TCP 192.168.1.100:32794 > 192.168.31.185:http PA / Raw
2024-04-20T20:24:25.340592,192.168.1.100,192.168.31.185,65340,100,60,http,normal,80,IP / TCP 192.168.1.100:65340 > 192.168.31.185:http PA / Raw
2024-04-20T20:24:25.344581,192.168.1.100,192.168.31.185,19764,100,60,http,normal,80,IP / TCP 192.168.1.100:19764 > 192.168.31.185:http PA / Raw
2024-04-20T20:24:25.349569,192.168.1.100,192.168.31.185,45414,100,60,http,normal,80,IP / TCP 192.168.1.100:45414 > 192.168.31.185:http PA / Raw
2024-04-20T20:24:25.353506,192.168.1.100,192.168.31.185,3250,100,60,http,normal,80,IP / TCP 192.168.1.100:3250 > 192.168.31.185:http PA / Raw
2024-04-20T20:24:25.357495,192.168.1.100,192.168.31.185,62684,100,60,http,normal,80,IP / TCP 192.168.1.100:62684 > 192.168.31.185:http PA / Raw
2024-04-20T20:24:25.362482,192.168.1.100,192.168.31.185,51835,100,60,http,normal,80,IP / TCP 192.168.1.100:51835 > 192.168.31.185:http PA / Raw
2024-04-20T20:24:25.366471,192.168.1.100,192.168.31.185,31030,100,60,http,normal,80,IP / TCP 192.168.1.100:31030 > 192.168.31.185:http PA / Raw
2024-04-20T20:24:25.371458,192.168.1.100,192.168.31.185,48401,100,60,http,normal,80,IP / TCP 192.168.1.100:48401 > 192.168.31.185:http PA / Raw
2024-04-20T20:24:25.375448,192.168.1.100,192.168.31.185,34161,100,60,http,normal,80,IP / TCP 192.168.1.100:34161 > 192.168.31.185:http PA / Raw
2024-04-20T20:24:25.379437,192.168.1.100,192.168.31.185,16751,100,60,http,normal,80,IP / TCP 192.168.1.100:16751 > 192.168.31.185:http PA / Raw
2024-04-20T20:24:25.383426,192.168.1.100,192.168.31.185,30394,100,60,http,normal,80,IP / TCP 192.168.1.100:30394 > 192.168.31.185:http PA / Raw
2024-04-20T20:24:25.387415,192.168.1.100,192.168.31.185,55317,100,60,http,normal,80,IP / TCP 192.168.1.100:55317 > 192.168.31.185:http PA / Raw
2024-04-20T20:24:25.391405,192.168.1.100,192.168.31.185,39645,100,60,http,normal,80,IP / TCP 192.168.1.100:39645 > 192.168.31.185:http PA / Raw
2024-04-20T20:24:25.396392,192.168.1.100,192.168.31.185,41426,100,60,http,normal,80,IP / TCP 192.168.1.100:41426 > 192.168.31.185:http PA / Raw
2024-04-20T20:24:25.400405,192.168.1.100,192.168.31.185,7507,100,60,http,normal,80,IP / TCP 192.168.1.100:7507 > 192.168.31.185:http PA / Raw
2024-04-20T20:24:25.405391,192.168.1.100,192.168.31.185,20480,100,60,http,normal,80,IP / TCP 192.168.1.100:20480 > 192.168.31.185:http PA / Raw
2024-04-20T20:24:25.409357,192.168.1.100,192.168.31.185,10936,100,60,http,normal,80,IP / TCP 192.168.1.100:10936 > 192.168.31.185:http PA / Raw
2024-04-20T20:24:25.413346,192.168.1.100,192.168.31.185,57407,100,60,http,normal,80,IP / TCP 192.168.1.100:57407 > 192.168.31.185:http PA / Raw
2024-04-20T20:24:25.417335,192.168.1.100,192.168.31.185,20684,100,60,http,normal,80,IP / TCP 192.168.1.100:20684 > 192.168.31.185:http PA / Raw
2024-04-20T20:24:25.421349,192.168.1.100,192.168.31.185,39804,100,60,http,normal,80,IP / TCP 192.168.1.100:39804 > 192.168.31.185:http PA / Raw
2024-04-20T20:24:25.426311,192.168.1.100,192.168.31.185,32545,100,60,http,normal,80,IP / TCP 192.168.1.100:32545 > 192.168.31.185:http PA / Raw
2024-04-20T20:24:25.430301,192.168.1.100,192.168.31.185,20421,100,60,http,normal,80,IP / TCP 192.168.1.100:20421 > 192.168.31.185:http PA / Raw
2024-04-20T20:24:25.434290,192.168.1.100,192.168.31.185,49485,100,60,http,normal,80,IP / TCP 192.168.1.100:49485 > 192.168.31.185:http PA / Raw
2024-04-20T20:24:25.439277,192.168.1.100,192.168.31.185,46448,100,60,http,normal,80,IP / TCP 192.168.1.100:46448 > 192.168.31.185:http PA / Raw
2024-04-20T20:24:25.443153,192.168.1.100,192.168.31.185,7264,100,60,http,normal,80,IP / TCP 192.168.1.100:7264 > 192.168.31.185:http PA / Raw
2024-04-20T20:24:25.448143,192.168.1.100,192.168.31.185,20246,100,60,http,normal,80,IP / TCP 192.168.1.100:20246 > 192.168.31.185:http PA / Raw
2024-04-20T20:24:25.452132,192.168.1.100,192.168.31.185,18303,100,60,http,normal,80,IP / TCP 192.168.1.100:18303 > 192.168.31.185:http PA / Raw
2024-04-20T20:24:25.456122,209.101.240.169,192.168.31.185,57473,100,1164,icmp,malicious,28,IP / ICMP 209.101.240.169 > 192.168.31.185 echo-request 0
2024-04-20T20:24:25.461108,169.160.182.55,192.168.31.185,59042,100,1223,icmp,malicious,28,IP / ICMP 169.160.182.55 > 192.168.31.185 echo-request 0
2024-04-20T20:24:25.464100,254.69.169.212,192.168.31.185,57392,100,1051,udp,malicious,28,IP / UDP 254.69.169.212:57392 > 192.168.31.185:100
2024-04-20T20:24:25.468089,180.196.69.238,192.168.31.185,25750,100,1488,udp,malicious,28,IP / UDP 180.196.69.238:25750 > 192.168.31.185:100
2024-04-20T20:24:25.472079,71.17.141.23,192.168.31.185,60269,100,555,syn,malicious,40,IP / TCP 71.17.141.23:60269 > 192.168.31.185:100 S
2024-04-20T20:24:25.475094,26.144.114.199,192.168.31.185,4610,100,809,udp,malicious,28,IP / UDP 26.144.114.199:4610 > 192.168.31.185:100
2024-04-20T20:24:25.479060,20.184.39.32,192.168.31.185,33592,100,982,syn,malicious,40,IP / TCP 20.184.39.32:33592 > 192.168.31.185:100 S
2024-04-20T20:24:25.483049,65.219.118.124,192.168.31.185,27213,100,1034,syn,malicious,40,IP / TCP 65.219.118.124:27213 > 192.168.31.185:100 S
2024-04-20T20:24:25.487038,224.28.246.112,192.168.31.185,1228,100,523,udp,malicious,28,IP / UDP 224.28.246.112:1228 > 192.168.31.185:100
2024-04-20T20:24:25.490701,22.44.57.66,192.168.31.185,41458,100,267,udp,malicious,28,IP / UDP 22.44.57.66:41458 > 192.168.31.185:100
2024-04-20T20:24:25.494691,216.186.18.176,192.168.31.185,49003,100,1377,icmp,malicious,28,IP / ICMP 216.186.18.176 > 192.168.31.185 echo-request 0
2024-04-20T20:24:25.498680,183.194.165.208,192.168.31.185,46653,100,245,udp,malicious,28,IP / UDP 183.194.165.208:46653 > 192.168.31.185:100
2024-04-20T20:24:25.502696,173.84.203.8,192.168.31.185,22858,100,1033,syn,malicious,40,IP / TCP 173.84.203.8:22858 > 192.168.31.185:100 S
2024-04-20T20:24:25.506659,33.102.224.147,192.168.31.185,59514,100,249,icmp,malicious,28,IP / ICMP 33.102.224.147 > 192.168.31.185 echo-request 0
2024-04-20T20:24:25.510648,142.171.129.61,192.168.31.185,7632,100,95,syn,malicious,40,IP / TCP 142.171.129.61:7632 > 192.168.31.185:100 S
2024-04-20T20:24:25.514661,105.139.222.207,192.168.31.185,48606,100,513,syn,malicious,40,IP / TCP 105.139.222.207:48606 > 192.168.31.185:100 S
2024-04-20T20:24:25.518626,189.136.84.163,192.168.31.185,33213,100,1476,syn,malicious,40,IP / TCP 189.136.84.163:33213 > 192.168.31.185:100 S
2024-04-20T20:24:25.522616,11.102.150.127,192.168.31.185,47113,100,684,syn,malicious,40,IP / TCP 11.102.150.127:47113 > 192.168.31.185:100 S
2024-04-20T20:24:25.526605,121.165.154.59,192.168.31.185,51157,100,143,udp,malicious,28,IP / UDP 121.165.154.59:51157 > 192.168.31.185:100
2024-04-20T20:24:25.530584,78.169.16.147,192.168.31.185,42594,100,153,icmp,malicious,28,IP / ICMP 78.169.16.147 > 192.168.31.185 echo-request 0
2024-04-20T20:24:25.535574,163.73.64.55,192.168.31.185,3308,100,1425,icmp,malicious,28,IP / ICMP 163.73.64.55 > 192.168.31.185 echo-request 0
2024-04-20T20:24:25.539563,226.240.32.17,192.168.31.185,65468,100,1152,udp,malicious,28,IP / UDP 226.240.32.17:65468 > 192.168.31.185:100
2024-04-20T20:24:25.544550,149.131.223.192,192.168.31.185,5583,100,486,icmp,malicious,28,IP / ICMP 149.131.223.192 > 192.168.31.185 echo-request 0
2024-04-20T20:24:25.548538,136.98.188.74,192.168.31.185,34686,100,205,syn,malicious,40,IP / TCP 136.98.188.74:34686 > 192.168.31.185:100 S
2024-04-20T20:24:25.552528,160.212.249.198,192.168.31.185,2760,100,47,udp,malicious,28,IP / UDP 160.212.249.198:2760 > 192.168.31.185:100
2024-04-20T20:24:25.556517,87.6.72.92,192.168.31.185,27390,100,1332,syn,malicious,40,IP / TCP 87.6.72.92:27390 > 192.168.31.185:100 S
2024-04-20T20:24:25.560506,2.143.159.125,192.168.31.185,22028,100,185,icmp,malicious,28,IP / ICMP 2.143.159.125 > 192.168.31.185 echo-request 0
2024-04-20T20:24:25.564496,129.227.168.223,192.168.31.185,33345,100,1318,udp,malicious,28,IP / UDP 129.227.168.223:33345 > 192.168.31.185:100
2024-04-20T20:24:25.569483,103.87.126.16,192.168.31.185,54178,100,793,icmp,malicious,28,IP / ICMP 103.87.126.16 > 192.168.31.185 echo-request 0
2024-04-20T20:24:25.574470,83.110.43.218,192.168.31.185,14665,100,629,udp,malicious,28,IP / UDP 83.110.43.218:14665 > 192.168.31.185:100
2024-04-20T20:24:25.578459,246.146.134.9,192.168.31.185,25142,100,218,udp,malicious,28,IP / UDP 246.146.134.9:25142 > 192.168.31.185:100
2024-04-20T20:24:25.582448,20.177.136.48,192.168.31.185,64567,100,1195,syn,malicious,40,IP / TCP 20.177.136.48:64567 > 192.168.31.185:100 S
2024-04-20T20:24:25.586437,190.108.149.108,192.168.31.185,42775,100,396,udp,malicious,28,IP / UDP 190.108.149.108:42775 > 192.168.31.185:100
2024-04-20T20:24:25.590427,127.176.110.91,192.168.31.185,4695,100,761,udp,malicious,28,IP / UDP 127.176.110.91:4695 > 192.168.31.185:100
2024-04-20T20:24:25.594416,103.167.91.3,192.168.31.185,57644,100,756,syn,malicious,40,IP / TCP 103.167.91.3:57644 > 192.168.31.185:100 S
2024-04-20T20:24:25.598406,70.249.26.236,192.168.31.185,47701,100,895,syn,malicious,40,IP / TCP 70.249.26.236:47701 > 192.168.31.185:100 S
2024-04-20T20:24:25.602394,12.216.184.136,192.168.31.185,47738,100,652,syn,malicious,40,IP / TCP 12.216.184.136:47738 > 192.168.31.185:100 S
2024-04-20T20:24:25.606384,88.86.110.211,192.168.31.185,25436,100,490,syn,malicious,40,IP / TCP 88.86.110.211:25436 > 192.168.31.185:100 S
2024-04-20T20:24:25.610374,35.192.234.129,192.168.31.185,51262,100,687,syn,malicious,40,IP / TCP 35.192.234.129:51262 > 192.168.31.185:100 S
2024-04-20T20:24:25.614362,52.47.78.210,192.168.31.185,13415,100,971,icmp,malicious,28,IP / ICMP 52.47.78.210 > 192.168.31.185 echo-request 0
2024-04-20T20:24:25.618351,59.88.165.222,192.168.31.185,11598,100,142,udp,malicious,28,IP / UDP 59.88.165.222:11598 > 192.168.31.185:100
2024-04-20T20:24:25.621815,64.238.87.99,192.168.31.185,35482,100,1088,udp,malicious,28,IP / UDP 64.238.87.99:35482 > 192.168.31.185:100
2024-04-20T20:24:25.625805,129.105.219.252,192.168.31.185,16983,100,1061,udp,malicious,28,IP / UDP 129.105.219.252:16983 > 192.168.31.185:100
2024-04-20T20:24:25.629794,159.194.50.122,192.168.31.185,42267,100,344,icmp,malicious,28,IP / ICMP 159.194.50.122 > 192.168.31.185 echo-request 0
2024-04-20T20:24:25.633783,219.67.168.59,192.168.31.185,63769,100,1101,udp,malicious,28,IP / UDP 219.67.168.59:63769 > 192.168.31.185:100
2024-04-20T20:24:25.637772,112.128.39.247,192.168.31.185,25975,100,1232,syn,malicious,40,IP / TCP 112.128.39.247:25975 > 192.168.31.185:100 S
2024-04-20T20:24:25.641762,101.79.4.61,192.168.31.185,22515,100,176,syn,malicious,40,IP / TCP 101.79.4.61:22515 > 192.168.31.185:100 S
2024-04-20T20:24:25.645751,180.53.178.184,192.168.31.185,1135,100,1369,syn,malicious,40,IP / TCP 180.53.178.184:1135 > 192.168.31.185:100 S
2024-04-20T20:24:25.649740,105.249.157.1,192.168.31.185,16636,100,1287,icmp,malicious,28,IP / ICMP 105.249.157.1 > 192.168.31.185 echo-request 0
2024-04-20T20:24:25.653730,198.17.206.18,192.168.31.185,48240,100,1344,syn,malicious,40,IP / TCP 198.17.206.18:48240 > 192.168.31.185:100 S
2024-04-20T20:24:25.657719,27.125.160.146,192.168.31.185,6919,100,1203,icmp,malicious,28,IP / ICMP 27.125.160.146 > 192.168.31.185 echo-request 0
2024-04-20T20:24:25.662707,190.230.27.106,192.168.31.185,65447,100,175,syn,malicious,40,IP / TCP 190.230.27.106:65447 > 192.168.31.185:100 S
2024-04-20T20:24:25.667693,244.243.13.164,192.168.31.185,22782,100,182,syn,malicious,40,IP / TCP 244.243.13.164:22782 > 192.168.31.185:100 S
2024-04-20T20:24:25.670684,7.238.155.185,192.168.31.185,61888,100,606,udp,malicious,28,IP / UDP 7.238.155.185:61888 > 192.168.31.185:100
2024-04-20T20:24:25.675671,254.232.94.28,192.168.31.185,43873,100,169,udp,malicious,28,IP / UDP 254.232.94.28:43873 > 192.168.31.185:100
2024-04-20T20:24:25.679661,199.128.111.238,192.168.31.185,39646,100,967,udp,malicious,28,IP / UDP 199.128.111.238:39646 > 192.168.31.185:100
2024-04-20T20:24:25.683650,139.104.18.111,192.168.31.185,57800,100,790,udp,malicious,28,IP / UDP 139.104.18.111:57800 > 192.168.31.185:100
2024-04-20T20:24:25.687640,4.93.154.106,192.168.31.185,44600,100,726,syn,malicious,40,IP / TCP 4.93.154.106:44600 > 192.168.31.185:100 S
2024-04-20T20:24:25.691629,132.41.182.123,192.168.31.185,44933,100,873,icmp,malicious,28,IP / ICMP 132.41.182.123 > 192.168.31.185 echo-request 0
2024-04-20T20:24:25.695618,136.49.36.171,192.168.31.185,64210,100,406,icmp,malicious,28,IP / ICMP 136.49.36.171 > 192.168.31.185 echo-request 0
2024-04-20T20:24:25.699607,1.219.171.28,192.168.31.185,33881,100,246,udp,malicious,28,IP / UDP 1.219.171.28:33881 > 192.168.31.185:100
2024-04-20T20:24:25.702599,84.80.165.220,192.168.31.185,27765,100,1383,udp,malicious,28,IP / UDP 84.80.165.220:27765 > 192.168.31.185:100
2024-04-20T20:24:25.707586,171.122.107.101,192.168.31.185,2575,100,701,udp,malicious,28,IP / UDP 171.122.107.101:2575 > 192.168.31.185:100
2024-04-20T20:24:25.711575,230.231.175.127,192.168.31.185,59554,100,644,icmp,malicious,28,IP / ICMP 230.231.175.127 > 192.168.31.185 echo-request 0
2024-04-20T20:24:25.715565,3.91.49.21,192.168.31.185,24929,100,357,udp,malicious,28,IP / UDP 3.91.49.21:24929 > 192.168.31.185:100
2024-04-20T20:24:25.719554,164.162.25.15,192.168.31.185,17530,100,1202,udp,malicious,28,IP / UDP 164.162.25.15:17530 > 192.168.31.185:100
2024-04-20T20:24:25.723543,124.114.233.133,192.168.31.185,4104,100,235,udp,malicious,28,IP / UDP 124.114.233.133:4104 > 192.168.31.185:100
2024-04-20T20:24:25.726535,211.55.89.137,192.168.31.185,52158,100,543,syn,malicious,40,IP / TCP 211.55.89.137:52158 > 192.168.31.185:100 S
2024-04-20T20:24:25.730735,34.161.159.238,192.168.31.185,20433,100,981,syn,malicious,40,IP / TCP 34.161.159.238:20433 > 192.168.31.185:100 S
2024-04-20T20:24:25.734727,208.222.62.39,192.168.31.185,26542,100,294,udp,malicious,28,IP / UDP 208.222.62.39:26542 > 192.168.31.185:100
2024-04-20T20:24:25.738717,13.69.174.70,192.168.31.185,64524,100,153,udp,malicious,28,IP / UDP 13.69.174.70:64524 > 192.168.31.185:100
2024-04-20T20:24:25.742706,145.41.68.50,192.168.31.185,20407,100,1252,icmp,malicious,28,IP / ICMP 145.41.68.50 > 192.168.31.185 echo-request 0
2024-04-20T20:24:25.746695,107.195.213.216,192.168.31.185,50791,100,871,icmp,malicious,28,IP / ICMP 107.195.213.216 > 192.168.31.185 echo-request 0
2024-04-20T20:24:25.750685,37.105.63.177,192.168.31.185,21793,100,1183,syn,malicious,40,IP / TCP 37.105.63.177:21793 > 192.168.31.185:100 S
2024-04-20T20:24:25.754673,88.221.59.244,192.168.31.185,33246,100,336,syn,malicious,40,IP / TCP 88.221.59.244:33246 > 192.168.31.185:100 S
2024-04-20T20:24:25.758663,143.24.106.157,192.168.31.185,7473,100,354,udp,malicious,28,IP / UDP 143.24.106.157:7473 > 192.168.31.185:100
2024-04-20T20:24:25.761655,156.43.16.152,192.168.31.185,20386,100,990,udp,malicious,28,IP / UDP 156.43.16.152:20386 > 192.168.31.185:100
2024-04-20T20:24:25.765755,192.92.67.50,192.168.31.185,11984,100,206,icmp,malicious,28,IP / ICMP 192.92.67.50 > 192.168.31.185 echo-request 0
2024-04-20T20:24:25.769767,30.149.159.199,192.168.31.185,32539,100,397,udp,malicious,28,IP / UDP 30.149.159.199:32539 > 192.168.31.185:100
2024-04-20T20:24:25.774730,196.104.24.245,192.168.31.185,18600,100,1338,icmp,malicious,28,IP / ICMP 196.104.24.245 > 192.168.31.185 echo-request 0
2024-04-20T20:24:25.778720,172.10.71.237,192.168.31.185,13433,100,1265,udp,malicious,28,IP / UDP 172.10.71.237:13433 > 192.168.31.185:100
2024-04-20T20:24:25.782709,211.58.37.101,192.168.31.185,5498,100,539,icmp,malicious,28,IP / ICMP 211.58.37.101 > 192.168.31.185 echo-request 0
2024-04-20T20:24:25.786698,70.235.87.51,192.168.31.185,40072,100,230,udp,malicious,28,IP / UDP 70.235.87.51:40072 > 192.168.31.185:100
2024-04-20T20:24:25.791773,10.98.58.204,192.168.31.185,52009,100,375,syn,malicious,40,IP / TCP 10.98.58.204:52009 > 192.168.31.185:100 S
2024-04-20T20:24:25.794764,173.133.64.82,192.168.31.185,11736,100,935,syn,malicious,40,IP / TCP 173.133.64.82:11736 > 192.168.31.185:100 S
2024-04-20T20:24:25.799751,20.197.163.82,192.168.31.185,50283,100,774,icmp,malicious,28,IP / ICMP 20.197.163.82 > 192.168.31.185 echo-request 0
2024-04-20T20:24:25.802743,80.168.194.227,192.168.31.185,52027,100,306,udp,malicious,28,IP / UDP 80.168.194.227:52027 > 192.168.31.185:100
2024-04-20T20:24:25.807684,251.143.246.148,192.168.31.185,1804,100,452,syn,malicious,40,IP / TCP 251.143.246.148:1804 > 192.168.31.185:100 S
2024-04-20T20:24:25.810973,127.66.15.92,192.168.31.185,26323,100,461,icmp,malicious,28,IP / ICMP 127.66.15.92 > 192.168.31.185 echo-request 0
2024-04-20T20:24:25.815270,119.209.184.17,192.168.31.185,50208,100,1187,syn,malicious,40,IP / TCP 119.209.184.17:50208 > 192.168.31.185:100 S
2024-04-20T20:24:25.819262,194.195.93.188,192.168.31.185,30589,100,870,udp,malicious,28,IP / UDP 194.195.93.188:30589 > 192.168.31.185:100
2024-04-20T20:24:25.823251,205.236.177.107,192.168.31.185,40276,100,1346,syn,malicious,40,IP / TCP 205.236.177.107:40276 > 192.168.31.185:100 S
2024-04-20T20:24:25.827240,93.3.15.176,192.168.31.185,15849,100,326,syn,malicious,40,IP / TCP 93.3.15.176:15849 > 192.168.31.185:100 S
2024-04-20T20:24:25.831230,124.1.24.88,192.168.31.185,21166,100,1468,syn,malicious,40,IP / TCP 124.1.24.88:21166 > 192.168.31.185:100 S
2024-04-20T20:24:25.835219,30.243.23.78,192.168.31.185,37588,100,920,syn,malicious,40,IP / TCP 30.243.23.78:37588 > 192.168.31.185:100 S
2024-04-20T20:24:25.839208,39.131.80.198,192.168.31.185,8706,100,898,syn,malicious,40,IP / TCP 39.131.80.198:8706 > 192.168.31.185:100 S
2024-04-20T20:24:25.843198,176.32.95.93,192.168.31.185,53247,100,378,syn,malicious,40,IP / TCP 176.32.95.93:53247 > 192.168.31.185:100 S
2024-04-20T20:24:25.847187,147.163.93.221,192.168.31.185,11929,100,510,syn,malicious,40,IP / TCP 147.163.93.221:11929 > 192.168.31.185:100 S
2024-04-20T20:24:25.851176,51.52.77.97,192.168.31.185,15315,100,1238,icmp,malicious,28,IP / ICMP 51.52.77.97 > 192.168.31.185 echo-request 0
2024-04-20T20:24:25.855166,12.5.107.142,192.168.31.185,26709,100,1064,syn,malicious,40,IP / TCP 12.5.107.142:26709 > 192.168.31.185:100 S
2024-04-20T20:24:25.860153,119.53.78.93,192.168.31.185,63448,100,344,icmp,malicious,28,IP / ICMP 119.53.78.93 > 192.168.31.185 echo-request 0
2024-04-20T20:24:25.864142,170.182.56.142,192.168.31.185,16212,100,293,syn,malicious,40,IP / TCP 170.182.56.142:16212 > 192.168.31.185:100 S
2024-04-20T20:24:25.868131,133.3.233.138,192.168.31.185,12358,100,826,syn,malicious,40,IP / TCP 133.3.233.138:12358 > 192.168.31.185:100 S
2024-04-20T20:24:25.871123,118.108.198.198,192.168.31.185,32524,100,670,udp,malicious,28,IP / UDP 118.108.198.198:32524 > 192.168.31.185:100
2024-04-20T20:24:25.876111,133.176.210.146,192.168.31.185,42801,100,947,syn,malicious,40,IP / TCP 133.176.210.146:42801 > 192.168.31.185:100 S
2024-04-20T20:24:25.880099,18.49.112.189,192.168.31.185,22855,100,417,syn,malicious,40,IP / TCP 18.49.112.189:22855 > 192.168.31.185:100 S
2024-04-20T20:24:25.885087,142.26.107.172,192.168.31.185,57046,100,952,icmp,malicious,28,IP / ICMP 142.26.107.172 > 192.168.31.185 echo-request 0
2024-04-20T20:24:25.888975,11.70.250.195,192.168.31.185,1063,100,1279,icmp,malicious,28,IP / ICMP 11.70.250.195 > 192.168.31.185 echo-request 0
2024-04-20T20:24:25.893962,27.254.80.189,192.168.31.185,6563,100,354,icmp,malicious,28,IP / ICMP 27.254.80.189 > 192.168.31.185 echo-request 0
2024-04-20T20:24:25.897978,59.49.204.61,192.168.31.185,49204,100,380,icmp,malicious,28,IP / ICMP 59.49.204.61 > 192.168.31.185 echo-request 0
2024-04-20T20:24:25.901969,56.18.101.252,192.168.31.185,3530,100,1163,udp,malicious,28,IP / UDP 56.18.101.252:3530 > 192.168.31.185:100
2024-04-20T20:24:25.905958,142.108.54.174,192.168.31.185,64739,100,1462,udp,malicious,28,IP / UDP 142.108.54.174:64739 > 192.168.31.185:100
2024-04-20T20:24:25.911942,88.243.86.202,192.168.31.185,61646,100,129,syn,malicious,40,IP / TCP 88.243.86.202:61646 > 192.168.31.185:100 S
2024-04-20T20:24:25.916929,209.99.37.139,192.168.31.185,9784,100,376,udp,malicious,28,IP / UDP 209.99.37.139:9784 > 192.168.31.185:100
2024-04-20T20:24:25.921915,202.169.107.190,192.168.31.185,12818,100,369,icmp,malicious,28,IP / ICMP 202.169.107.190 > 192.168.31.185 echo-request 0
2024-04-20T20:24:25.926902,35.8.250.132,192.168.31.185,48913,100,1052,icmp,malicious,28,IP / ICMP 35.8.250.132 > 192.168.31.185 echo-request 0
2024-04-20T20:24:25.931888,106.141.75.16,192.168.31.185,1904,100,1497,syn,malicious,40,IP / TCP 106.141.75.16:1904 > 192.168.31.185:100 S
2024-04-20T20:24:25.937873,238.187.166.41,192.168.31.185,2790,100,1493,icmp,malicious,28,IP / ICMP 238.187.166.41 > 192.168.31.185 echo-request 0
2024-04-20T20:24:25.941862,196.76.168.170,192.168.31.185,10119,100,440,syn,malicious,40,IP / TCP 196.76.168.170:10119 > 192.168.31.185:100 S
2024-04-20T20:24:25.946849,85.163.17.51,192.168.31.185,41840,100,1138,syn,malicious,40,IP / TCP 85.163.17.51:41840 > 192.168.31.185:100 S
2024-04-20T20:24:25.951835,161.95.53.129,192.168.31.185,16956,100,382,icmp,malicious,28,IP / ICMP 161.95.53.129 > 192.168.31.185 echo-request 0
2024-04-20T20:24:25.956822,127.107.32.218,192.168.31.185,61365,100,1287,icmp,malicious,28,IP / ICMP 127.107.32.218 > 192.168.31.185 echo-request 0
2024-04-20T20:24:25.961810,246.50.80.201,192.168.31.185,29267,100,703,icmp,malicious,28,IP / ICMP 246.50.80.201 > 192.168.31.185 echo-request 0
2024-04-20T20:24:25.966796,56.202.177.241,192.168.31.185,36293,100,311,icmp,malicious,28,IP / ICMP 56.202.177.241 > 192.168.31.185 echo-request 0
2024-04-20T20:24:25.972780,97.55.64.38,192.168.31.185,34835,100,1337,syn,malicious,40,IP / TCP 97.55.64.38:34835 > 192.168.31.185:100 S
2024-04-20T20:24:25.977767,189.158.67.60,192.168.31.185,1940,100,49,icmp,malicious,28,IP / ICMP 189.158.67.60 > 192.168.31.185 echo-request 0
2024-04-20T20:24:25.981755,59.2.66.76,192.168.31.185,22625,100,1236,syn,malicious,40,IP / TCP 59.2.66.76:22625 > 192.168.31.185:100 S
2024-04-20T20:24:25.986743,94.74.9.155,192.168.31.185,46593,100,1053,udp,malicious,28,IP / UDP 94.74.9.155:46593 > 192.168.31.185:100
2024-04-20T20:24:25.990732,231.188.32.202,192.168.31.185,39113,100,942,icmp,malicious,28,IP / ICMP 231.188.32.202 > 192.168.31.185 echo-request 0
2024-04-20T20:24:25.995718,47.63.207.38,192.168.31.185,14829,100,334,syn,malicious,40,IP / TCP 47.63.207.38:14829 > 192.168.31.185:100 S
2024-04-20T20:24:25.999708,196.1.82.6,192.168.31.185,34233,100,217,udp,malicious,28,IP / UDP 196.1.82.6:34233 > 192.168.31.185:100
2024-04-20T20:24:26.003032,65.80.176.170,192.168.31.185,24339,100,1137,syn,malicious,40,IP / TCP 65.80.176.170:24339 > 192.168.31.185:100 S
2024-04-20T20:24:26.007018,160.124.236.95,192.168.31.185,60408,100,448,icmp,malicious,28,IP / ICMP 160.124.236.95 > 192.168.31.185 echo-request 0
2024-04-20T20:24:26.011007,205.7.149.165,192.168.31.185,40860,100,902,udp,malicious,28,IP / UDP 205.7.149.165:40860 > 192.168.31.185:100
2024-04-20T20:24:26.014970,241.80.175.125,192.168.31.185,49027,100,240,icmp,malicious,28,IP / ICMP 241.80.175.125 > 192.168.31.185 echo-request 0
2024-04-20T20:24:26.018960,179.37.213.111,192.168.31.185,55001,100,764,udp,malicious,28,IP / UDP 179.37.213.111:55001 > 192.168.31.185:100
2024-04-20T20:24:26.023947,242.53.87.227,192.168.31.185,33014,100,325,udp,malicious,28,IP / UDP 242.53.87.227:33014 > 192.168.31.185:100
2024-04-20T20:24:26.027935,238.54.164.35,192.168.31.185,10442,100,261,udp,malicious,28,IP / UDP 238.54.164.35:10442 > 192.168.31.185:100
2024-04-20T20:24:26.033920,91.173.69.245,192.168.31.185,52712,100,590,icmp,malicious,28,IP / ICMP 91.173.69.245 > 192.168.31.185 echo-request 0
2024-04-20T20:24:26.038906,71.6.166.207,192.168.31.185,8194,100,1122,udp,malicious,28,IP / UDP 71.6.166.207:8194 > 192.168.31.185:100
2024-04-20T20:24:26.042896,135.248.103.227,192.168.31.185,5752,100,1379,udp,malicious,28,IP / UDP 135.248.103.227:5752 > 192.168.31.185:100
2024-04-20T20:24:26.047883,247.243.145.62,192.168.31.185,60023,100,269,udp,malicious,28,IP / UDP 247.243.145.62:60023 > 192.168.31.185:100
2024-04-20T20:24:26.051901,171.204.179.218,192.168.31.185,11698,100,536,udp,malicious,28,IP / UDP 171.204.179.218:11698 > 192.168.31.185:100
2024-04-20T20:24:26.055862,101.237.53.231,192.168.31.185,6408,100,1152,icmp,malicious,28,IP / ICMP 101.237.53.231 > 192.168.31.185 echo-request 0
2024-04-20T20:24:26.059876,114.206.107.129,192.168.31.185,61903,100,1198,udp,malicious,28,IP / UDP 114.206.107.129:61903 > 192.168.31.185:100
2024-04-20T20:24:26.063865,21.64.121.245,192.168.31.185,46170,100,787,syn,malicious,40,IP / TCP 21.64.121.245:46170 > 192.168.31.185:100 S
2024-04-20T20:24:26.067829,138.222.43.194,192.168.31.185,11188,100,1248,syn,malicious,40,IP / TCP 138.222.43.194:11188 > 192.168.31.185:100 S
2024-04-20T20:24:26.071819,67.171.145.148,192.168.31.185,46192,100,466,udp,malicious,28,IP / UDP 67.171.145.148:46192 > 192.168.31.185:100
2024-04-20T20:24:26.075808,210.52.8.22,192.168.31.185,11302,100,1493,udp,malicious,28,IP / UDP 210.52.8.22:11302 > 192.168.31.185:100
2024-04-20T20:24:26.079797,120.14.48.225,192.168.31.185,4590,100,1320,udp,malicious,28,IP / UDP 120.14.48.225:4590 > 192.168.31.185:100
2024-04-20T20:24:26.083786,97.97.70.170,192.168.31.185,46721,100,1107,icmp,malicious,28,IP / ICMP 97.97.70.170 > 192.168.31.185 echo-request 0
2024-04-20T20:24:26.087776,109.207.219.100,192.168.31.185,47721,100,310,icmp,malicious,28,IP / ICMP 109.207.219.100 > 192.168.31.185 echo-request 0
2024-04-20T20:24:26.091790,127.46.204.42,192.168.31.185,13125,100,1213,icmp,malicious,28,IP / ICMP 127.46.204.42 > 192.168.31.185 echo-request 0
2024-04-20T20:24:26.095755,13.150.152.130,192.168.31.185,28692,100,1139,udp,malicious,28,IP / UDP 13.150.152.130:28692 > 192.168.31.185:100
2024-04-20T20:24:26.099744,87.228.140.199,192.168.31.185,11675,100,1128,syn,malicious,40,IP / TCP 87.228.140.199:11675 > 192.168.31.185:100 S
2024-04-20T20:24:26.103757,35.176.17.235,192.168.31.185,7144,100,72,udp,malicious,28,IP / UDP 35.176.17.235:7144 > 192.168.31.185:100
2024-04-20T20:24:26.107723,193.50.229.83,192.168.31.185,45038,100,875,syn,malicious,40,IP / TCP 193.50.229.83:45038 > 192.168.31.185:100 S
2024-04-20T20:24:26.111712,184.192.140.150,192.168.31.185,18300,100,741,udp,malicious,28,IP / UDP 184.192.140.150:18300 > 192.168.31.185:100
2024-04-20T20:24:26.115725,220.148.9.19,192.168.31.185,40098,100,1411,icmp,malicious,28,IP / ICMP 220.148.9.19 > 192.168.31.185 echo-request 0
2024-04-20T20:24:26.119612,115.201.180.29,192.168.31.185,11926,100,215,syn,malicious,40,IP / TCP 115.201.180.29:11926 > 192.168.31.185:100 S
2024-04-20T20:24:26.124543,70.91.107.119,192.168.31.185,22954,100,557,syn,malicious,40,IP / TCP 70.91.107.119:22954 > 192.168.31.185:100 S
2024-04-20T20:24:26.127590,232.13.1.90,192.168.31.185,58621,100,1216,syn,malicious,40,IP / TCP 232.13.1.90:58621 > 192.168.31.185:100 S
2024-04-20T20:24:26.132669,71.190.120.207,192.168.31.185,6542,100,97,icmp,malicious,28,IP / ICMP 71.190.120.207 > 192.168.31.185 echo-request 0
2024-04-20T20:24:26.136658,125.117.62.42,192.168.31.185,58731,100,1389,udp,malicious,28,IP / UDP 125.117.62.42:58731 > 192.168.31.185:100
2024-04-20T20:24:26.140647,38.232.58.95,192.168.31.185,55936,100,706,syn,malicious,40,IP / TCP 38.232.58.95:55936 > 192.168.31.185:100 S
2024-04-20T20:24:26.145634,18.113.238.219,192.168.31.185,10439,100,616,udp,malicious,28,IP / UDP 18.113.238.219:10439 > 192.168.31.185:100
2024-04-20T20:24:26.149623,143.66.200.126,192.168.31.185,62512,100,1478,udp,malicious,28,IP / UDP 143.66.200.126:62512 > 192.168.31.185:100
2024-04-20T20:24:26.153612,84.63.26.240,192.168.31.185,9850,100,617,icmp,malicious,28,IP / ICMP 84.63.26.240 > 192.168.31.185 echo-request 0
2024-04-20T20:24:26.157601,156.22.253.97,192.168.31.185,24603,100,1165,icmp,malicious,28,IP / ICMP 156.22.253.97 > 192.168.31.185 echo-request 0
2024-04-20T20:24:26.162588,90.204.164.99,192.168.31.185,13461,100,403,udp,malicious,28,IP / UDP 90.204.164.99:13461 > 192.168.31.185:100
2024-04-20T20:24:26.166713,242.208.56.181,192.168.31.185,48246,100,723,syn,malicious,40,IP / TCP 242.208.56.181:48246 > 192.168.31.185:100 S
2024-04-20T20:24:26.170563,106.203.43.40,192.168.31.185,13865,100,1258,udp,malicious,28,IP / UDP 106.203.43.40:13865 > 192.168.31.185:100
2024-04-20T20:24:26.175146,129.245.18.126,192.168.31.185,58150,100,297,syn,malicious,40,IP / TCP 129.245.18.126:58150 > 192.168.31.185:100 S
2024-04-20T20:24:26.178163,79.209.67.213,192.168.31.185,47656,100,1491,syn,malicious,40,IP / TCP 79.209.67.213:47656 > 192.168.31.185:100 S
2024-04-20T20:24:26.182127,16.164.134.191,192.168.31.185,57487,100,236,syn,malicious,40,IP / TCP 16.164.134.191:57487 > 192.168.31.185:100 S
2024-04-20T20:24:26.186116,244.150.207.20,192.168.31.185,25128,100,1241,icmp,malicious,28,IP / ICMP 244.150.207.20 > 192.168.31.185 echo-request 0
2024-04-20T20:24:26.190106,219.42.49.191,192.168.31.185,32385,100,252,syn,malicious,40,IP / TCP 219.42.49.191:32385 > 192.168.31.185:100 S
2024-04-20T20:24:26.194095,205.72.9.47,192.168.31.185,59774,100,1195,syn,malicious,40,IP / TCP 205.72.9.47:59774 > 192.168.31.185:100 S
2024-04-20T20:24:26.197087,117.23.44.252,192.168.31.185,15322,100,1428,syn,malicious,40,IP / TCP 117.23.44.252:15322 > 192.168.31.185:100 S
2024-04-20T20:24:26.201076,115.130.92.11,192.168.31.185,60606,100,1212,udp,malicious,28,IP / UDP 115.130.92.11:60606 > 192.168.31.185:100
2024-04-20T20:24:26.205066,77.127.173.247,192.168.31.185,44655,100,805,udp,malicious,28,IP / UDP 77.127.173.247:44655 > 192.168.31.185:100
2024-04-20T20:24:26.208058,244.53.58.248,192.168.31.185,24785,100,466,syn,malicious,40,IP / TCP 244.53.58.248:24785 > 192.168.31.185:100 S
