timestamp,source_ip,target_ip,source_port,target_port,packet_size,attack_mode,label,packet_length,packet_summary
2024-04-21T17:23:09.654028,192.168.1.100,192.168.31.185,50375,100,60,http,normal,80,IP / TCP 192.168.1.100:50375 > 192.168.31.185:http PA / Raw
2024-04-21T17:23:09.661010,192.168.1.100,192.168.31.185,24765,100,60,http,normal,80,IP / TCP 192.168.1.100:24765 > 192.168.31.185:http PA / Raw
2024-04-21T17:23:09.668989,192.168.1.100,192.168.31.185,34512,100,60,http,normal,80,IP / TCP 192.168.1.100:34512 > 192.168.31.185:http PA / Raw
2024-04-21T17:23:09.676968,192.168.1.100,192.168.31.185,34851,100,60,http,normal,80,IP / TCP 192.168.1.100:34851 > 192.168.31.185:http PA / Raw
2024-04-21T17:23:09.684946,192.168.1.100,192.168.31.185,45855,100,60,http,normal,80,IP / TCP 192.168.1.100:45855 > 192.168.31.185:http PA / Raw
2024-04-21T17:23:09.691927,192.168.1.100,192.168.31.185,49799,100,60,http,normal,80,IP / TCP 192.168.1.100:49799 > 192.168.31.185:http PA / Raw
2024-04-21T17:23:09.697912,192.168.1.100,192.168.31.185,7145,100,60,http,normal,80,IP / TCP 192.168.1.100:7145 > 192.168.31.185:http PA / Raw
2024-04-21T17:23:09.702898,192.168.1.100,192.168.31.185,4329,100,60,http,normal,80,IP / TCP 192.168.1.100:4329 > 192.168.31.185:http PA / Raw
2024-04-21T17:23:09.710877,192.168.1.100,192.168.31.185,39297,100,60,http,normal,80,IP / TCP 192.168.1.100:39297 > 192.168.31.185:http PA / Raw
2024-04-21T17:23:09.721848,192.168.1.100,192.168.31.185,4209,100,60,http,normal,80,IP / TCP 192.168.1.100:4209 > 192.168.31.185:http PA / Raw
2024-04-21T17:23:09.730824,192.168.1.100,192.168.31.185,34862,100,60,http,normal,80,IP / TCP 192.168.1.100:34862 > 192.168.31.185:http PA / Raw
2024-04-21T17:23:09.737805,192.168.1.100,192.168.31.185,54173,100,60,http,normal,80,IP / TCP 192.168.1.100:54173 > 192.168.31.185:http PA / Raw
2024-04-21T17:23:09.746781,192.168.1.100,192.168.31.185,64466,100,60,http,normal,80,IP / TCP 192.168.1.100:64466 > 192.168.31.185:http PA / Raw
2024-04-21T17:23:09.753762,192.168.1.100,192.168.31.185,50995,100,60,http,normal,80,IP / TCP 192.168.1.100:50995 > 192.168.31.185:http PA / Raw
2024-04-21T17:23:09.760743,192.168.1.100,192.168.31.185,36116,100,60,http,normal,80,IP / TCP 192.168.1.100:36116 > 192.168.31.185:http PA / Raw
2024-04-21T17:23:09.765730,192.168.1.100,192.168.31.185,25058,100,60,http,normal,80,IP / TCP 192.168.1.100:25058 > 192.168.31.185:http PA / Raw
2024-04-21T17:23:09.774705,192.168.1.100,192.168.31.185,21776,100,60,http,normal,80,IP / TCP 192.168.1.100:21776 > 192.168.31.185:http PA / Raw
2024-04-21T17:23:09.781688,192.168.1.100,192.168.31.185,16983,100,60,http,normal,80,IP / TCP 192.168.1.100:16983 > 192.168.31.185:http PA / Raw
2024-04-21T17:23:09.788668,192.168.1.100,192.168.31.185,37754,100,60,http,normal,80,IP / TCP 192.168.1.100:37754 > 192.168.31.185:http PA / Raw
2024-04-21T17:23:09.792658,192.168.1.100,192.168.31.185,17480,100,60,http,normal,80,IP / TCP 192.168.1.100:17480 > 192.168.31.185:http PA / Raw
2024-04-21T17:23:09.797644,192.168.1.100,192.168.31.185,5997,100,60,http,normal,80,IP / TCP 192.168.1.100:5997 > 192.168.31.185:http PA / Raw
2024-04-21T17:23:09.801634,192.168.1.100,192.168.31.185,28816,100,60,http,normal,80,IP / TCP 192.168.1.100:28816 > 192.168.31.185:http PA / Raw
2024-04-21T17:23:09.807618,192.168.1.100,192.168.31.185,46220,100,60,http,normal,80,IP / TCP 192.168.1.100:46220 > 192.168.31.185:http PA / Raw
2024-04-21T17:23:09.812604,192.168.1.100,192.168.31.185,54885,100,60,http,normal,80,IP / TCP 192.168.1.100:54885 > 192.168.31.185:http PA / Raw
2024-04-21T17:23:09.816594,192.168.1.100,192.168.31.185,59130,100,60,http,normal,80,IP / TCP 192.168.1.100:59130 > 192.168.31.185:http PA / Raw
2024-04-21T17:23:09.821580,192.168.1.100,192.168.31.185,48088,100,60,http,normal,80,IP / TCP 192.168.1.100:48088 > 192.168.31.185:http PA / Raw
2024-04-21T17:23:09.825570,192.168.1.100,192.168.31.185,9300,100,60,http,normal,80,IP / TCP 192.168.1.100:9300 > 192.168.31.185:http PA / Raw
2024-04-21T17:23:09.830558,192.168.1.100,192.168.31.185,20215,100,60,http,normal,80,IP / TCP 192.168.1.100:20215 > 192.168.31.185:http PA / Raw
2024-04-21T17:23:09.836541,192.168.1.100,192.168.31.185,52117,100,60,http,normal,80,IP / TCP 192.168.1.100:52117 > 192.168.31.185:http PA / Raw
2024-04-21T17:23:09.841527,192.168.1.100,192.168.31.185,20633,100,60,http,normal,80,IP / TCP 192.168.1.100:20633 > 192.168.31.185:http PA / Raw
2024-04-21T17:23:09.847511,192.168.1.100,192.168.31.185,30993,100,60,http,normal,80,IP / TCP 192.168.1.100:30993 > 192.168.31.185:http PA / Raw
2024-04-21T17:23:09.853495,192.168.1.100,192.168.31.185,11524,100,60,http,normal,80,IP / TCP 192.168.1.100:11524 > 192.168.31.185:http PA / Raw
2024-04-21T17:23:09.859479,192.168.1.100,192.168.31.185,6261,100,60,http,normal,80,IP / TCP 192.168.1.100:6261 > 192.168.31.185:http PA / Raw
2024-04-21T17:23:09.864465,192.168.1.100,192.168.31.185,34676,100,60,http,normal,80,IP / TCP 192.168.1.100:34676 > 192.168.31.185:http PA / Raw
2024-04-21T17:23:09.873442,192.168.1.100,192.168.31.185,47551,100,60,http,normal,80,IP / TCP 192.168.1.100:47551 > 192.168.31.185:http PA / Raw
2024-04-21T17:23:09.881421,192.168.1.100,192.168.31.185,49678,100,60,http,normal,80,IP / TCP 192.168.1.100:49678 > 192.168.31.185:http PA / Raw
2024-04-21T17:23:09.887405,192.168.1.100,192.168.31.185,45756,100,60,http,normal,80,IP / TCP 192.168.1.100:45756 > 192.168.31.185:http PA / Raw
2024-04-21T17:23:09.904359,192.168.1.100,192.168.31.185,40291,100,60,http,normal,80,IP / TCP 192.168.1.100:40291 > 192.168.31.185:http PA / Raw
2024-04-21T17:23:09.915330,192.168.1.100,192.168.31.185,30809,100,60,http,normal,80,IP / TCP 192.168.1.100:30809 > 192.168.31.185:http PA / Raw
2024-04-21T17:23:09.922313,192.168.1.100,192.168.31.185,7241,100,60,http,normal,80,IP / TCP 192.168.1.100:7241 > 192.168.31.185:http PA / Raw
2024-04-21T17:23:09.934280,192.168.1.100,192.168.31.185,8327,100,60,http,normal,80,IP / TCP 192.168.1.100:8327 > 192.168.31.185:http PA / Raw
2024-04-21T17:23:09.942259,192.168.1.100,192.168.31.185,23779,100,60,http,normal,80,IP / TCP 192.168.1.100:23779 > 192.168.31.185:http PA / Raw
2024-04-21T17:23:09.949239,192.168.1.100,192.168.31.185,16936,100,60,http,normal,80,IP / TCP 192.168.1.100:16936 > 192.168.31.185:http PA / Raw
2024-04-21T17:23:09.956222,192.168.1.100,192.168.31.185,57377,100,60,http,normal,80,IP / TCP 192.168.1.100:57377 > 192.168.31.185:http PA / Raw
2024-04-21T17:23:09.964200,192.168.1.100,192.168.31.185,63811,100,60,http,normal,80,IP / TCP 192.168.1.100:63811 > 192.168.31.185:http PA / Raw
2024-04-21T17:23:09.972179,192.168.1.100,192.168.31.185,59254,100,60,http,normal,80,IP / TCP 192.168.1.100:59254 > 192.168.31.185:http PA / Raw
2024-04-21T17:23:09.979159,192.168.1.100,192.168.31.185,30394,100,60,http,normal,80,IP / TCP 192.168.1.100:30394 > 192.168.31.185:http PA / Raw
2024-04-21T17:23:09.987139,192.168.1.100,192.168.31.185,44059,100,60,http,normal,80,IP / TCP 192.168.1.100:44059 > 192.168.31.185:http PA / Raw
2024-04-21T17:23:09.995117,192.168.1.100,192.168.31.185,51518,100,60,http,normal,80,IP / TCP 192.168.1.100:51518 > 192.168.31.185:http PA / Raw
2024-04-21T17:23:10.001101,192.168.1.100,192.168.31.185,63327,100,60,http,normal,80,IP / TCP 192.168.1.100:63327 > 192.168.31.185:http PA / Raw
2024-04-21T17:23:10.010078,192.168.1.100,192.168.31.185,59280,100,60,http,normal,80,IP / TCP 192.168.1.100:59280 > 192.168.31.185:http PA / Raw
2024-04-21T17:23:10.020051,192.168.1.100,192.168.31.185,3434,100,60,http,normal,80,IP / TCP 192.168.1.100:3434 > 192.168.31.185:http PA / Raw
2024-04-21T17:23:10.031021,192.168.1.100,192.168.31.185,14044,100,60,http,normal,80,IP / TCP 192.168.1.100:14044 > 192.168.31.185:http PA / Raw
2024-04-21T17:23:10.039998,192.168.1.100,192.168.31.185,27173,100,60,http,normal,80,IP / TCP 192.168.1.100:27173 > 192.168.31.185:http PA / Raw
2024-04-21T17:23:10.046979,192.168.1.100,192.168.31.185,25213,100,60,http,normal,80,IP / TCP 192.168.1.100:25213 > 192.168.31.185:http PA / Raw
2024-04-21T17:23:10.054957,192.168.1.100,192.168.31.185,11638,100,60,http,normal,80,IP / TCP 192.168.1.100:11638 > 192.168.31.185:http PA / Raw
2024-04-21T17:23:10.060941,192.168.1.100,192.168.31.185,15399,100,60,http,normal,80,IP / TCP 192.168.1.100:15399 > 192.168.31.185:http PA / Raw
2024-04-21T17:23:10.065927,192.168.1.100,192.168.31.185,22178,100,60,http,normal,80,IP / TCP 192.168.1.100:22178 > 192.168.31.185:http PA / Raw
2024-04-21T17:23:10.072909,192.168.1.100,192.168.31.185,53946,100,60,http,normal,80,IP / TCP 192.168.1.100:53946 > 192.168.31.185:http PA / Raw
2024-04-21T17:23:10.078892,192.168.1.100,192.168.31.185,62503,100,60,http,normal,80,IP / TCP 192.168.1.100:62503 > 192.168.31.185:http PA / Raw
2024-04-21T17:23:10.083879,192.168.1.100,192.168.31.185,19650,100,60,http,normal,80,IP / TCP 192.168.1.100:19650 > 192.168.31.185:http PA / Raw
2024-04-21T17:23:10.087868,192.168.1.100,192.168.31.185,64523,100,60,http,normal,80,IP / TCP 192.168.1.100:64523 > 192.168.31.185:http PA / Raw
2024-04-21T17:23:10.092855,192.168.1.100,192.168.31.185,33948,100,60,http,normal,80,IP / TCP 192.168.1.100:33948 > 192.168.31.185:http PA / Raw
2024-04-21T17:23:10.098839,192.168.1.100,192.168.31.185,50052,100,60,http,normal,80,IP / TCP 192.168.1.100:50052 > 192.168.31.185:http PA / Raw
2024-04-21T17:23:10.102828,192.168.1.100,192.168.31.185,55300,100,60,http,normal,80,IP / TCP 192.168.1.100:55300 > 192.168.31.185:http PA / Raw
2024-04-21T17:23:10.107814,192.168.1.100,192.168.31.185,55247,100,60,http,normal,80,IP / TCP 192.168.1.100:55247 > 192.168.31.185:http PA / Raw
2024-04-21T17:23:10.112801,192.168.1.100,192.168.31.185,9002,100,60,http,normal,80,IP / TCP 192.168.1.100:9002 > 192.168.31.185:http PA / Raw
2024-04-21T17:23:10.117789,192.168.1.100,192.168.31.185,51074,100,60,http,normal,80,IP / TCP 192.168.1.100:51074 > 192.168.31.185:http PA / Raw
2024-04-21T17:23:10.122775,192.168.1.100,192.168.31.185,25924,100,60,http,normal,80,IP / TCP 192.168.1.100:25924 > 192.168.31.185:http PA / Raw
2024-04-21T17:23:10.128759,192.168.1.100,192.168.31.185,57398,100,60,http,normal,80,IP / TCP 192.168.1.100:57398 > 192.168.31.185:http PA / Raw
2024-04-21T17:23:10.134743,192.168.1.100,192.168.31.185,10734,100,60,http,normal,80,IP / TCP 192.168.1.100:10734 > 192.168.31.185:http PA / Raw
2024-04-21T17:23:10.140727,192.168.1.100,192.168.31.185,2160,100,60,http,normal,80,IP / TCP 192.168.1.100:2160 > 192.168.31.185:http PA / Raw
2024-04-21T17:23:10.145714,192.168.1.100,192.168.31.185,32650,100,60,http,normal,80,IP / TCP 192.168.1.100:32650 > 192.168.31.185:http PA / Raw
2024-04-21T17:23:10.151698,192.168.1.100,192.168.31.185,31080,100,60,http,normal,80,IP / TCP 192.168.1.100:31080 > 192.168.31.185:http PA / Raw
2024-04-21T17:23:10.157682,192.168.1.100,192.168.31.185,3880,100,60,http,normal,80,IP / TCP 192.168.1.100:3880 > 192.168.31.185:http PA / Raw
2024-04-21T17:23:10.162668,192.168.1.100,192.168.31.185,47295,100,60,http,normal,80,IP / TCP 192.168.1.100:47295 > 192.168.31.185:http PA / Raw
2024-04-21T17:23:10.168652,192.168.1.100,192.168.31.185,44610,100,60,http,normal,80,IP / TCP 192.168.1.100:44610 > 192.168.31.185:http PA / Raw
2024-04-21T17:23:10.174636,192.168.1.100,192.168.31.185,47092,100,60,http,normal,80,IP / TCP 192.168.1.100:47092 > 192.168.31.185:http PA / Raw
2024-04-21T17:23:10.180657,192.168.1.100,192.168.31.185,38670,100,60,http,normal,80,IP / TCP 192.168.1.100:38670 > 192.168.31.185:http PA / Raw
2024-04-21T17:23:10.186605,192.168.1.100,192.168.31.185,11617,100,60,http,normal,80,IP / TCP 192.168.1.100:11617 > 192.168.31.185:http PA / Raw
2024-04-21T17:23:10.193585,192.168.1.100,192.168.31.185,61157,100,60,http,normal,80,IP / TCP 192.168.1.100:61157 > 192.168.31.185:http PA / Raw
2024-04-21T17:23:10.198573,192.168.1.100,192.168.31.185,48726,100,60,http,normal,80,IP / TCP 192.168.1.100:48726 > 192.168.31.185:http PA / Raw
2024-04-21T17:23:10.204556,192.168.1.100,192.168.31.185,36961,100,60,http,normal,80,IP / TCP 192.168.1.100:36961 > 192.168.31.185:http PA / Raw
2024-04-21T17:23:10.210541,192.168.1.100,192.168.31.185,12766,100,60,http,normal,80,IP / TCP 192.168.1.100:12766 > 192.168.31.185:http PA / Raw
2024-04-21T17:23:10.215527,192.168.1.100,192.168.31.185,58095,100,60,http,normal,80,IP / TCP 192.168.1.100:58095 > 192.168.31.185:http PA / Raw
2024-04-21T17:23:10.221510,192.168.1.100,192.168.31.185,61397,100,60,http,normal,80,IP / TCP 192.168.1.100:61397 > 192.168.31.185:http PA / Raw
2024-04-21T17:23:10.226498,192.168.1.100,192.168.31.185,10769,100,60,http,normal,80,IP / TCP 192.168.1.100:10769 > 192.168.31.185:http PA / Raw
2024-04-21T17:23:10.232481,192.168.1.100,192.168.31.185,19968,100,60,http,normal,80,IP / TCP 192.168.1.100:19968 > 192.168.31.185:http PA / Raw
2024-04-21T17:23:10.239462,192.168.1.100,192.168.31.185,21193,100,60,http,normal,80,IP / TCP 192.168.1.100:21193 > 192.168.31.185:http PA / Raw
2024-04-21T17:23:10.245447,192.168.1.100,192.168.31.185,28436,100,60,http,normal,80,IP / TCP 192.168.1.100:28436 > 192.168.31.185:http PA / Raw
2024-04-21T17:23:10.251431,192.168.1.100,192.168.31.185,60851,100,60,http,normal,80,IP / TCP 192.168.1.100:60851 > 192.168.31.185:http PA / Raw
2024-04-21T17:23:10.256418,192.168.1.100,192.168.31.185,8014,100,60,http,normal,80,IP / TCP 192.168.1.100:8014 > 192.168.31.185:http PA / Raw
2024-04-21T17:23:10.262402,192.168.1.100,192.168.31.185,64848,100,60,http,normal,80,IP / TCP 192.168.1.100:64848 > 192.168.31.185:http PA / Raw
2024-04-21T17:23:10.268386,192.168.1.100,192.168.31.185,32693,100,60,http,normal,80,IP / TCP 192.168.1.100:32693 > 192.168.31.185:http PA / Raw
2024-04-21T17:23:10.274369,192.168.1.100,192.168.31.185,15812,100,60,http,normal,80,IP / TCP 192.168.1.100:15812 > 192.168.31.185:http PA / Raw
2024-04-21T17:23:10.280354,192.168.1.100,192.168.31.185,36161,100,60,http,normal,80,IP / TCP 192.168.1.100:36161 > 192.168.31.185:http PA / Raw
2024-04-21T17:23:10.286337,192.168.1.100,192.168.31.185,52830,100,60,http,normal,80,IP / TCP 192.168.1.100:52830 > 192.168.31.185:http PA / Raw
2024-04-21T17:23:10.292322,192.168.1.100,192.168.31.185,24625,100,60,http,normal,80,IP / TCP 192.168.1.100:24625 > 192.168.31.185:http PA / Raw
2024-04-21T17:23:10.298305,192.168.1.100,192.168.31.185,6429,100,60,http,normal,80,IP / TCP 192.168.1.100:6429 > 192.168.31.185:http PA / Raw
2024-04-21T17:23:10.303292,192.168.1.100,192.168.31.185,35402,100,60,http,normal,80,IP / TCP 192.168.1.100:35402 > 192.168.31.185:http PA / Raw
2024-04-21T17:23:10.308279,192.168.1.100,192.168.31.185,19955,100,60,http,normal,80,IP / TCP 192.168.1.100:19955 > 192.168.31.185:http PA / Raw
2024-04-21T17:23:10.314263,192.168.1.100,192.168.31.185,50508,100,60,http,normal,80,IP / TCP 192.168.1.100:50508 > 192.168.31.185:http PA / Raw
2024-04-21T17:23:10.319249,192.168.1.100,192.168.31.185,64823,100,60,http,normal,80,IP / TCP 192.168.1.100:64823 > 192.168.31.185:http PA / Raw
2024-04-21T17:23:10.326231,192.168.1.100,192.168.31.185,37409,100,60,http,normal,80,IP / TCP 192.168.1.100:37409 > 192.168.31.185:http PA / Raw
2024-04-21T17:23:10.331217,192.168.1.100,192.168.31.185,36671,100,60,http,normal,80,IP / TCP 192.168.1.100:36671 > 192.168.31.185:http PA / Raw
2024-04-21T17:23:10.336204,192.168.1.100,192.168.31.185,64995,100,60,http,normal,80,IP / TCP 192.168.1.100:64995 > 192.168.31.185:http PA / Raw
2024-04-21T17:23:10.342188,192.168.1.100,192.168.31.185,3625,100,60,http,normal,80,IP / TCP 192.168.1.100:3625 > 192.168.31.185:http PA / Raw
2024-04-21T17:23:10.348172,192.168.1.100,192.168.31.185,29389,100,60,http,normal,80,IP / TCP 192.168.1.100:29389 > 192.168.31.185:http PA / Raw
2024-04-21T17:23:10.353159,192.168.1.100,192.168.31.185,35359,100,60,http,normal,80,IP / TCP 192.168.1.100:35359 > 192.168.31.185:http PA / Raw
2024-04-21T17:23:10.359143,192.168.1.100,192.168.31.185,2716,100,60,http,normal,80,IP / TCP 192.168.1.100:2716 > 192.168.31.185:http PA / Raw
2024-04-21T17:23:10.364131,192.168.1.100,192.168.31.185,54077,100,60,http,normal,80,IP / TCP 192.168.1.100:54077 > 192.168.31.185:http PA / Raw
2024-04-21T17:23:10.369116,192.168.1.100,192.168.31.185,47930,100,60,http,normal,80,IP / TCP 192.168.1.100:47930 > 192.168.31.185:http PA / Raw
2024-04-21T17:23:10.374103,192.168.1.100,192.168.31.185,26967,100,60,http,normal,80,IP / TCP 192.168.1.100:26967 > 192.168.31.185:http PA / Raw
2024-04-21T17:23:10.379089,192.168.1.100,192.168.31.185,25149,100,60,http,normal,80,IP / TCP 192.168.1.100:25149 > 192.168.31.185:http PA / Raw
2024-04-21T17:23:10.384076,192.168.1.100,192.168.31.185,60448,100,60,http,normal,80,IP / TCP 192.168.1.100:60448 > 192.168.31.185:http PA / Raw
2024-04-21T17:23:10.389062,192.168.1.100,192.168.31.185,63919,100,60,http,normal,80,IP / TCP 192.168.1.100:63919 > 192.168.31.185:http PA / Raw
2024-04-21T17:23:10.393052,192.168.1.100,192.168.31.185,63063,100,60,http,normal,80,IP / TCP 192.168.1.100:63063 > 192.168.31.185:http PA / Raw
2024-04-21T17:23:10.398038,192.168.1.100,192.168.31.185,48070,100,60,http,normal,80,IP / TCP 192.168.1.100:48070 > 192.168.31.185:http PA / Raw
2024-04-21T17:23:10.403025,192.168.1.100,192.168.31.185,20012,100,60,http,normal,80,IP / TCP 192.168.1.100:20012 > 192.168.31.185:http PA / Raw
2024-04-21T17:23:10.407015,192.168.1.100,192.168.31.185,38880,100,60,http,normal,80,IP / TCP 192.168.1.100:38880 > 192.168.31.185:http PA / Raw
2024-04-21T17:23:10.412002,192.168.1.100,192.168.31.185,51398,100,60,http,normal,80,IP / TCP 192.168.1.100:51398 > 192.168.31.185:http PA / Raw
2024-04-21T17:23:10.416988,192.168.1.100,192.168.31.185,3801,100,60,http,normal,80,IP / TCP 192.168.1.100:3801 > 192.168.31.185:http PA / Raw
2024-04-21T17:23:10.422972,192.168.1.100,192.168.31.185,60804,100,60,http,normal,80,IP / TCP 192.168.1.100:60804 > 192.168.31.185:http PA / Raw
2024-04-21T17:23:10.428957,192.168.1.100,192.168.31.185,13653,100,60,http,normal,80,IP / TCP 192.168.1.100:13653 > 192.168.31.185:http PA / Raw
2024-04-21T17:23:10.434941,192.168.1.100,192.168.31.185,40668,100,60,http,normal,80,IP / TCP 192.168.1.100:40668 > 192.168.31.185:http PA / Raw
2024-04-21T17:23:10.439927,192.168.1.100,192.168.31.185,42831,100,60,http,normal,80,IP / TCP 192.168.1.100:42831 > 192.168.31.185:http PA / Raw
2024-04-21T17:23:10.445910,192.168.1.100,192.168.31.185,41818,100,60,http,normal,80,IP / TCP 192.168.1.100:41818 > 192.168.31.185:http PA / Raw
2024-04-21T17:23:10.450897,192.168.1.100,192.168.31.185,60447,100,60,http,normal,80,IP / TCP 192.168.1.100:60447 > 192.168.31.185:http PA / Raw
2024-04-21T17:23:10.456881,192.168.1.100,192.168.31.185,61962,100,60,http,normal,80,IP / TCP 192.168.1.100:61962 > 192.168.31.185:http PA / Raw
2024-04-21T17:23:10.460871,192.168.1.100,192.168.31.185,21091,100,60,http,normal,80,IP / TCP 192.168.1.100:21091 > 192.168.31.185:http PA / Raw
2024-04-21T17:23:10.465857,192.168.1.100,192.168.31.185,35508,100,60,http,normal,80,IP / TCP 192.168.1.100:35508 > 192.168.31.185:http PA / Raw
2024-04-21T17:23:10.470844,192.168.1.100,192.168.31.185,57012,100,60,http,normal,80,IP / TCP 192.168.1.100:57012 > 192.168.31.185:http PA / Raw
2024-04-21T17:23:10.476828,192.168.1.100,192.168.31.185,22372,100,60,http,normal,80,IP / TCP 192.168.1.100:22372 > 192.168.31.185:http PA / Raw
2024-04-21T17:23:10.482812,192.168.1.100,192.168.31.185,15004,100,60,http,normal,80,IP / TCP 192.168.1.100:15004 > 192.168.31.185:http PA / Raw
2024-04-21T17:23:10.487798,192.168.1.100,192.168.31.185,25176,100,60,http,normal,80,IP / TCP 192.168.1.100:25176 > 192.168.31.185:http PA / Raw
2024-04-21T17:23:10.491788,192.168.1.100,192.168.31.185,15124,100,60,http,normal,80,IP / TCP 192.168.1.100:15124 > 192.168.31.185:http PA / Raw
2024-04-21T17:23:10.497772,192.168.1.100,192.168.31.185,11765,100,60,http,normal,80,IP / TCP 192.168.1.100:11765 > 192.168.31.185:http PA / Raw
2024-04-21T17:23:10.503756,192.168.1.100,192.168.31.185,46643,100,60,http,normal,80,IP / TCP 192.168.1.100:46643 > 192.168.31.185:http PA / Raw
2024-04-21T17:23:10.508742,192.168.1.100,192.168.31.185,11769,100,60,http,normal,80,IP / TCP 192.168.1.100:11769 > 192.168.31.185:http PA / Raw
2024-04-21T17:23:10.513729,192.168.1.100,192.168.31.185,23365,100,60,http,normal,80,IP / TCP 192.168.1.100:23365 > 192.168.31.185:http PA / Raw
2024-04-21T17:23:10.518716,192.168.1.100,192.168.31.185,37053,100,60,http,normal,80,IP / TCP 192.168.1.100:37053 > 192.168.31.185:http PA / Raw
2024-04-21T17:23:10.522705,192.168.1.100,192.168.31.185,53963,100,60,http,normal,80,IP / TCP 192.168.1.100:53963 > 192.168.31.185:http PA / Raw
2024-04-21T17:23:10.527692,192.168.1.100,192.168.31.185,38925,100,60,http,normal,80,IP / TCP 192.168.1.100:38925 > 192.168.31.185:http PA / Raw
2024-04-21T17:23:10.533676,192.168.1.100,192.168.31.185,39258,100,60,http,normal,80,IP / TCP 192.168.1.100:39258 > 192.168.31.185:http PA / Raw
2024-04-21T17:23:10.538662,192.168.1.100,192.168.31.185,10527,100,60,http,normal,80,IP / TCP 192.168.1.100:10527 > 192.168.31.185:http PA / Raw
2024-04-21T17:23:10.543650,192.168.1.100,192.168.31.185,21448,100,60,http,normal,80,IP / TCP 192.168.1.100:21448 > 192.168.31.185:http PA / Raw
2024-04-21T17:23:10.548636,192.168.1.100,192.168.31.185,52295,100,60,http,normal,80,IP / TCP 192.168.1.100:52295 > 192.168.31.185:http PA / Raw
2024-04-21T17:23:10.553623,192.168.1.100,192.168.31.185,50644,100,60,http,normal,80,IP / TCP 192.168.1.100:50644 > 192.168.31.185:http PA / Raw
2024-04-21T17:23:10.559606,192.168.1.100,192.168.31.185,62765,100,60,http,normal,80,IP / TCP 192.168.1.100:62765 > 192.168.31.185:http PA / Raw
2024-04-21T17:23:10.564593,192.168.1.100,192.168.31.185,49927,100,60,http,normal,80,IP / TCP 192.168.1.100:49927 > 192.168.31.185:http PA / Raw
2024-04-21T17:23:10.571576,192.168.1.100,192.168.31.185,22255,100,60,http,normal,80,IP / TCP 192.168.1.100:22255 > 192.168.31.185:http PA / Raw
2024-04-21T17:23:10.578556,192.168.1.100,192.168.31.185,46108,100,60,http,normal,80,IP / TCP 192.168.1.100:46108 > 192.168.31.185:http PA / Raw
2024-04-21T17:23:10.585537,192.168.1.100,192.168.31.185,12696,100,60,http,normal,80,IP / TCP 192.168.1.100:12696 > 192.168.31.185:http PA / Raw
2024-04-21T17:23:10.592520,192.168.1.100,192.168.31.185,30708,100,60,http,normal,80,IP / TCP 192.168.1.100:30708 > 192.168.31.185:http PA / Raw
2024-04-21T17:23:10.598503,192.168.1.100,192.168.31.185,36436,100,60,http,normal,80,IP / TCP 192.168.1.100:36436 > 192.168.31.185:http PA / Raw
2024-04-21T17:23:10.605485,192.168.1.100,192.168.31.185,26477,100,60,http,normal,80,IP / TCP 192.168.1.100:26477 > 192.168.31.185:http PA / Raw
2024-04-21T17:23:10.612465,192.168.1.100,192.168.31.185,62792,100,60,http,normal,80,IP / TCP 192.168.1.100:62792 > 192.168.31.185:http PA / Raw
2024-04-21T17:23:10.620445,192.168.1.100,192.168.31.185,27970,100,60,http,normal,80,IP / TCP 192.168.1.100:27970 > 192.168.31.185:http PA / Raw
2024-04-21T17:23:10.627426,192.168.1.100,192.168.31.185,12563,100,60,http,normal,80,IP / TCP 192.168.1.100:12563 > 192.168.31.185:http PA / Raw
2024-04-21T17:23:10.634407,192.168.1.100,192.168.31.185,59106,100,60,http,normal,80,IP / TCP 192.168.1.100:59106 > 192.168.31.185:http PA / Raw
2024-04-21T17:23:10.639394,192.168.1.100,192.168.31.185,37442,100,60,http,normal,80,IP / TCP 192.168.1.100:37442 > 192.168.31.185:http PA / Raw
2024-04-21T17:23:10.646376,192.168.1.100,192.168.31.185,47153,100,60,http,normal,80,IP / TCP 192.168.1.100:47153 > 192.168.31.185:http PA / Raw
2024-04-21T17:23:10.652359,192.168.1.100,192.168.31.185,47184,100,60,http,normal,80,IP / TCP 192.168.1.100:47184 > 192.168.31.185:http PA / Raw
2024-04-21T17:23:10.659341,192.168.1.100,192.168.31.185,53627,100,60,http,normal,80,IP / TCP 192.168.1.100:53627 > 192.168.31.185:http PA / Raw
2024-04-21T17:23:10.666323,192.168.1.100,192.168.31.185,31331,100,60,http,normal,80,IP / TCP 192.168.1.100:31331 > 192.168.31.185:http PA / Raw
2024-04-21T17:23:10.674302,192.168.1.100,192.168.31.185,50896,100,60,http,normal,80,IP / TCP 192.168.1.100:50896 > 192.168.31.185:http PA / Raw
2024-04-21T17:23:10.681283,192.168.1.100,192.168.31.185,34958,100,60,http,normal,80,IP / TCP 192.168.1.100:34958 > 192.168.31.185:http PA / Raw
2024-04-21T17:23:10.690259,192.168.1.100,192.168.31.185,44553,100,60,http,normal,80,IP / TCP 192.168.1.100:44553 > 192.168.31.185:http PA / Raw
2024-04-21T17:23:10.696241,192.168.1.100,192.168.31.185,26268,100,60,http,normal,80,IP / TCP 192.168.1.100:26268 > 192.168.31.185:http PA / Raw
2024-04-21T17:23:10.703225,192.168.1.100,192.168.31.185,30975,100,60,http,normal,80,IP / TCP 192.168.1.100:30975 > 192.168.31.185:http PA / Raw
2024-04-21T17:23:10.711202,192.168.1.100,192.168.31.185,65007,100,60,http,normal,80,IP / TCP 192.168.1.100:65007 > 192.168.31.185:http PA / Raw
2024-04-21T17:23:10.718183,192.168.1.100,192.168.31.185,55095,100,60,http,normal,80,IP / TCP 192.168.1.100:55095 > 192.168.31.185:http PA / Raw
2024-04-21T17:23:10.724167,192.168.1.100,192.168.31.185,43811,100,60,http,normal,80,IP / TCP 192.168.1.100:43811 > 192.168.31.185:http PA / Raw
2024-04-21T17:23:10.730151,192.168.1.100,192.168.31.185,1959,100,60,http,normal,80,IP / TCP 192.168.1.100:1959 > 192.168.31.185:http PA / Raw
2024-04-21T17:23:10.735137,192.168.1.100,192.168.31.185,61701,100,60,http,normal,80,IP / TCP 192.168.1.100:61701 > 192.168.31.185:http PA / Raw
2024-04-21T17:23:10.739127,192.168.1.100,192.168.31.185,42901,100,60,http,normal,80,IP / TCP 192.168.1.100:42901 > 192.168.31.185:http PA / Raw
2024-04-21T17:23:10.744113,192.168.1.100,192.168.31.185,17218,100,60,http,normal,80,IP / TCP 192.168.1.100:17218 > 192.168.31.185:http PA / Raw
2024-04-21T17:23:10.749100,192.168.1.100,192.168.31.185,59667,100,60,http,normal,80,IP / TCP 192.168.1.100:59667 > 192.168.31.185:http PA / Raw
2024-04-21T17:23:10.755084,192.168.1.100,192.168.31.185,8918,100,60,http,normal,80,IP / TCP 192.168.1.100:8918 > 192.168.31.185:http PA / Raw
2024-04-21T17:23:10.760070,192.168.1.100,192.168.31.185,9097,100,60,http,normal,80,IP / TCP 192.168.1.100:9097 > 192.168.31.185:http PA / Raw
2024-04-21T17:23:10.764067,192.168.1.100,192.168.31.185,19524,100,60,http,normal,80,IP / TCP 192.168.1.100:19524 > 192.168.31.185:http PA / Raw
2024-04-21T17:23:10.769046,192.168.1.100,192.168.31.185,63074,100,60,http,normal,80,IP / TCP 192.168.1.100:63074 > 192.168.31.185:http PA / Raw
2024-04-21T17:23:10.774033,192.168.1.100,192.168.31.185,63415,100,60,http,normal,80,IP / TCP 192.168.1.100:63415 > 192.168.31.185:http PA / Raw
2024-04-21T17:23:10.779020,192.168.1.100,192.168.31.185,60406,100,60,http,normal,80,IP / TCP 192.168.1.100:60406 > 192.168.31.185:http PA / Raw
2024-04-21T17:23:10.783010,192.168.1.100,192.168.31.185,11314,100,60,http,normal,80,IP / TCP 192.168.1.100:11314 > 192.168.31.185:http PA / Raw
2024-04-21T17:23:10.787996,192.168.1.100,192.168.31.185,50033,100,60,http,normal,80,IP / TCP 192.168.1.100:50033 > 192.168.31.185:http PA / Raw
2024-04-21T17:23:10.793980,192.168.1.100,192.168.31.185,9002,100,60,http,normal,80,IP / TCP 192.168.1.100:9002 > 192.168.31.185:http PA / Raw
2024-04-21T17:23:10.797970,192.168.1.100,192.168.31.185,9454,100,60,http,normal,80,IP / TCP 192.168.1.100:9454 > 192.168.31.185:http PA / Raw
2024-04-21T17:23:10.802956,192.168.1.100,192.168.31.185,25009,100,60,http,normal,80,IP / TCP 192.168.1.100:25009 > 192.168.31.185:http PA / Raw
2024-04-21T17:23:10.807943,192.168.1.100,192.168.31.185,54179,100,60,http,normal,80,IP / TCP 192.168.1.100:54179 > 192.168.31.185:http PA / Raw
2024-04-21T17:23:10.812929,192.168.1.100,192.168.31.185,47126,100,60,http,normal,80,IP / TCP 192.168.1.100:47126 > 192.168.31.185:http PA / Raw
2024-04-21T17:23:10.819911,192.168.1.100,192.168.31.185,15635,100,60,http,normal,80,IP / TCP 192.168.1.100:15635 > 192.168.31.185:http PA / Raw
2024-04-21T17:23:10.826892,192.168.1.100,192.168.31.185,58661,100,60,http,normal,80,IP / TCP 192.168.1.100:58661 > 192.168.31.185:http PA / Raw
2024-04-21T17:23:10.831879,192.168.1.100,192.168.31.185,38427,100,60,http,normal,80,IP / TCP 192.168.1.100:38427 > 192.168.31.185:http PA / Raw
2024-04-21T17:23:10.836865,192.168.1.100,192.168.31.185,7361,100,60,http,normal,80,IP / TCP 192.168.1.100:7361 > 192.168.31.185:http PA / Raw
2024-04-21T17:23:10.841852,192.168.1.100,192.168.31.185,2334,100,60,http,normal,80,IP / TCP 192.168.1.100:2334 > 192.168.31.185:http PA / Raw
2024-04-21T17:23:10.846838,192.168.1.100,192.168.31.185,4813,100,60,http,normal,80,IP / TCP 192.168.1.100:4813 > 192.168.31.185:http PA / Raw
2024-04-21T17:23:10.851825,192.168.1.100,192.168.31.185,7695,100,60,http,normal,80,IP / TCP 192.168.1.100:7695 > 192.168.31.185:http PA / Raw
2024-04-21T17:23:10.856812,192.168.1.100,192.168.31.185,55416,100,60,http,normal,80,IP / TCP 192.168.1.100:55416 > 192.168.31.185:http PA / Raw
2024-04-21T17:23:10.861799,192.168.1.100,192.168.31.185,32113,100,60,http,normal,80,IP / TCP 192.168.1.100:32113 > 192.168.31.185:http PA / Raw
2024-04-21T17:23:10.866785,156.234.103.210,192.168.31.185,62217,100,1144,icmp,malicious,28,IP / ICMP 156.234.103.210 > 192.168.31.185 echo-request 0
2024-04-21T17:23:10.870775,118.193.138.222,192.168.31.185,20974,100,440,udp,malicious,28,IP / UDP 118.193.138.222:20974 > 192.168.31.185:100
2024-04-21T17:23:10.875762,98.23.30.78,192.168.31.185,60579,100,1407,icmp,malicious,28,IP / ICMP 98.23.30.78 > 192.168.31.185 echo-request 0
2024-04-21T17:23:10.879750,253.100.77.146,192.168.31.185,51908,100,143,udp,malicious,28,IP / UDP 253.100.77.146:51908 > 192.168.31.185:100
2024-04-21T17:23:10.883740,229.182.143.125,192.168.31.185,16130,100,695,syn,malicious,40,IP / TCP 229.182.143.125:16130 > 192.168.31.185:100 S
2024-04-21T17:23:10.888726,76.110.125.166,192.168.31.185,12434,100,444,syn,malicious,40,IP / TCP 76.110.125.166:12434 > 192.168.31.185:100 S
2024-04-21T17:23:10.893713,47.32.120.190,192.168.31.185,24409,100,424,udp,malicious,28,IP / UDP 47.32.120.190:24409 > 192.168.31.185:100
2024-04-21T17:23:10.898699,166.189.132.193,192.168.31.185,14689,100,817,icmp,malicious,28,IP / ICMP 166.189.132.193 > 192.168.31.185 echo-request 0
2024-04-21T17:23:10.903687,212.168.62.211,192.168.31.185,42889,100,1245,icmp,malicious,28,IP / ICMP 212.168.62.211 > 192.168.31.185 echo-request 0
2024-04-21T17:23:10.908673,238.147.149.126,192.168.31.185,31434,100,812,udp,malicious,28,IP / UDP 238.147.149.126:31434 > 192.168.31.185:100
2024-04-21T17:23:10.912663,61.84.227.212,192.168.31.185,7558,100,880,icmp,malicious,28,IP / ICMP 61.84.227.212 > 192.168.31.185 echo-request 0
2024-04-21T17:23:10.918647,13.55.159.127,192.168.31.185,59237,100,655,syn,malicious,40,IP / TCP 13.55.159.127:59237 > 192.168.31.185:100 S
2024-04-21T17:23:10.922636,252.171.175.115,192.168.31.185,13301,100,1317,syn,malicious,40,IP / TCP 252.171.175.115:13301 > 192.168.31.185:100 S
2024-04-21T17:23:10.927622,200.131.174.98,192.168.31.185,15824,100,1056,icmp,malicious,28,IP / ICMP 200.131.174.98 > 192.168.31.185 echo-request 0
2024-04-21T17:23:10.932609,246.132.179.132,192.168.31.185,7221,100,968,syn,malicious,40,IP / TCP 246.132.179.132:7221 > 192.168.31.185:100 S
2024-04-21T17:23:10.937596,156.117.19.65,192.168.31.185,27794,100,832,icmp,malicious,28,IP / ICMP 156.117.19.65 > 192.168.31.185 echo-request 0
2024-04-21T17:23:10.942583,63.45.51.246,192.168.31.185,34595,100,727,udp,malicious,28,IP / UDP 63.45.51.246:34595 > 192.168.31.185:100
2024-04-21T17:23:10.947570,94.201.151.81,192.168.31.185,39806,100,1266,syn,malicious,40,IP / TCP 94.201.151.81:39806 > 192.168.31.185:100 S
2024-04-21T17:23:10.952556,250.253.213.242,192.168.31.185,11660,100,1247,syn,malicious,40,IP / TCP 250.253.213.242:11660 > 192.168.31.185:100 S
2024-04-21T17:23:10.956546,153.143.12.42,192.168.31.185,7465,100,94,udp,malicious,28,IP / UDP 153.143.12.42:7465 > 192.168.31.185:100
2024-04-21T17:23:10.961532,184.74.166.120,192.168.31.185,12775,100,956,udp,malicious,28,IP / UDP 184.74.166.120:12775 > 192.168.31.185:100
2024-04-21T17:23:10.967516,117.119.203.62,192.168.31.185,59261,100,861,icmp,malicious,28,IP / ICMP 117.119.203.62 > 192.168.31.185 echo-request 0
2024-04-21T17:23:10.973500,12.123.102.210,192.168.31.185,32464,100,119,syn,malicious,40,IP / TCP 12.123.102.210:32464 > 192.168.31.185:100 S
2024-04-21T17:23:10.979483,207.182.111.184,192.168.31.185,33816,100,1341,udp,malicious,28,IP / UDP 207.182.111.184:33816 > 192.168.31.185:100
2024-04-21T17:23:10.984471,102.29.72.246,192.168.31.185,2887,100,863,icmp,malicious,28,IP / ICMP 102.29.72.246 > 192.168.31.185 echo-request 0
2024-04-21T17:23:10.990455,231.170.10.191,192.168.31.185,26803,100,199,udp,malicious,28,IP / UDP 231.170.10.191:26803 > 192.168.31.185:100
2024-04-21T17:23:11.008406,44.243.6.101,192.168.31.185,46124,100,674,syn,malicious,40,IP / TCP 44.243.6.101:46124 > 192.168.31.185:100 S
2024-04-21T17:23:11.017383,220.210.189.164,192.168.31.185,21871,100,1344,syn,malicious,40,IP / TCP 220.210.189.164:21871 > 192.168.31.185:100 S
2024-04-21T17:23:11.023367,65.210.185.205,192.168.31.185,33324,100,1199,icmp,malicious,28,IP / ICMP 65.210.185.205 > 192.168.31.185 echo-request 0
2024-04-21T17:23:11.029351,41.198.239.125,192.168.31.185,14335,100,1107,udp,malicious,28,IP / UDP 41.198.239.125:14335 > 192.168.31.185:100
2024-04-21T17:23:11.036332,78.73.32.179,192.168.31.185,7060,100,519,syn,malicious,40,IP / TCP 78.73.32.179:7060 > 192.168.31.185:100 S
2024-04-21T17:23:11.047303,161.31.182.30,192.168.31.185,13553,100,187,syn,malicious,40,IP / TCP 161.31.182.30:13553 > 192.168.31.185:100 S
2024-04-21T17:23:11.059271,58.153.145.207,192.168.31.185,24686,100,212,syn,malicious,40,IP / TCP 58.153.145.207:24686 > 192.168.31.185:100 S
2024-04-21T17:23:11.064258,251.11.129.39,192.168.31.185,56023,100,579,udp,malicious,28,IP / UDP 251.11.129.39:56023 > 192.168.31.185:100
2024-04-21T17:23:11.071239,109.94.112.179,192.168.31.185,65387,100,1237,udp,malicious,28,IP / UDP 109.94.112.179:65387 > 192.168.31.185:100
2024-04-21T17:23:11.078222,172.212.48.7,192.168.31.185,32462,100,1046,icmp,malicious,28,IP / ICMP 172.212.48.7 > 192.168.31.185 echo-request 0
2024-04-21T17:23:11.084204,86.24.130.252,192.168.31.185,34750,100,1084,syn,malicious,40,IP / TCP 86.24.130.252:34750 > 192.168.31.185:100 S
2024-04-21T17:23:11.091185,3.175.190.177,192.168.31.185,22190,100,939,udp,malicious,28,IP / UDP 3.175.190.177:22190 > 192.168.31.185:100
2024-04-21T17:23:11.096172,232.182.219.17,192.168.31.185,54863,100,1235,syn,malicious,40,IP / TCP 232.182.219.17:54863 > 192.168.31.185:100 S
2024-04-21T17:23:11.102157,32.178.123.253,192.168.31.185,22129,100,701,udp,malicious,28,IP / UDP 32.178.123.253:22129 > 192.168.31.185:100
2024-04-21T17:23:11.107144,51.229.118.135,192.168.31.185,12260,100,965,udp,malicious,28,IP / UDP 51.229.118.135:12260 > 192.168.31.185:100
2024-04-21T17:23:11.114125,118.111.138.38,192.168.31.185,19952,100,192,icmp,malicious,28,IP / ICMP 118.111.138.38 > 192.168.31.185 echo-request 0
2024-04-21T17:23:11.120108,181.15.84.129,192.168.31.185,3880,100,228,udp,malicious,28,IP / UDP 181.15.84.129:3880 > 192.168.31.185:100
2024-04-21T17:23:11.125094,219.75.123.193,192.168.31.185,21348,100,1472,icmp,malicious,28,IP / ICMP 219.75.123.193 > 192.168.31.185 echo-request 0
2024-04-21T17:23:11.130082,165.40.146.27,192.168.31.185,37219,100,1158,syn,malicious,40,IP / TCP 165.40.146.27:37219 > 192.168.31.185:100 S
2024-04-21T17:23:11.136066,231.115.224.11,192.168.31.185,41802,100,1294,icmp,malicious,28,IP / ICMP 231.115.224.11 > 192.168.31.185 echo-request 0
2024-04-21T17:23:11.141051,82.190.242.56,192.168.31.185,16824,100,833,udp,malicious,28,IP / UDP 82.190.242.56:16824 > 192.168.31.185:100
2024-04-21T17:23:11.146058,143.206.142.182,192.168.31.185,47853,100,792,syn,malicious,40,IP / TCP 143.206.142.182:47853 > 192.168.31.185:100 S
2024-04-21T17:23:11.151025,76.133.85.84,192.168.31.185,43844,100,1111,icmp,malicious,28,IP / ICMP 76.133.85.84 > 192.168.31.185 echo-request 0
2024-04-21T17:23:11.156012,213.126.231.94,192.168.31.185,22294,100,1235,udp,malicious,28,IP / UDP 213.126.231.94:22294 > 192.168.31.185:100
2024-04-21T17:23:11.161000,191.56.92.230,192.168.31.185,61352,100,1277,icmp,malicious,28,IP / ICMP 191.56.92.230 > 192.168.31.185 echo-request 0
2024-04-21T17:23:11.165987,43.78.115.205,192.168.31.185,14524,100,348,syn,malicious,40,IP / TCP 43.78.115.205:14524 > 192.168.31.185:100 S
2024-04-21T17:23:11.171969,108.20.91.39,192.168.31.185,49837,100,389,syn,malicious,40,IP / TCP 108.20.91.39:49837 > 192.168.31.185:100 S
2024-04-21T17:23:11.176956,131.122.145.122,192.168.31.185,55727,100,317,udp,malicious,28,IP / UDP 131.122.145.122:55727 > 192.168.31.185:100
2024-04-21T17:23:11.181942,149.155.130.84,192.168.31.185,45756,100,524,syn,malicious,40,IP / TCP 149.155.130.84:45756 > 192.168.31.185:100 S
2024-04-21T17:23:11.186929,32.125.181.215,192.168.31.185,59764,100,89,udp,malicious,28,IP / UDP 32.125.181.215:59764 > 192.168.31.185:100
2024-04-21T17:23:11.191916,217.48.98.250,192.168.31.185,5439,100,304,udp,malicious,28,IP / UDP 217.48.98.250:5439 > 192.168.31.185:100
2024-04-21T17:23:11.199895,66.205.170.101,192.168.31.185,56257,100,771,syn,malicious,40,IP / TCP 66.205.170.101:56257 > 192.168.31.185:100 S
2024-04-21T17:23:11.205879,7.131.45.132,192.168.31.185,14999,100,95,syn,malicious,40,IP / TCP 7.131.45.132:14999 > 192.168.31.185:100 S
2024-04-21T17:23:11.211863,91.106.139.86,192.168.31.185,61392,100,265,udp,malicious,28,IP / UDP 91.106.139.86:61392 > 192.168.31.185:100
2024-04-21T17:23:11.217847,14.144.195.187,192.168.31.185,11680,100,931,udp,malicious,28,IP / UDP 14.144.195.187:11680 > 192.168.31.185:100
2024-04-21T17:23:11.223830,81.41.112.209,192.168.31.185,23027,100,923,icmp,malicious,28,IP / ICMP 81.41.112.209 > 192.168.31.185 echo-request 0
2024-04-21T17:23:11.229815,10.72.231.130,192.168.31.185,40142,100,1299,udp,malicious,28,IP / UDP 10.72.231.130:40142 > 192.168.31.185:100
2024-04-21T17:23:11.235799,152.145.231.118,192.168.31.185,55079,100,1254,udp,malicious,28,IP / UDP 152.145.231.118:55079 > 192.168.31.185:100
2024-04-21T17:23:11.241784,182.199.135.153,192.168.31.185,25028,100,1080,syn,malicious,40,IP / TCP 182.199.135.153:25028 > 192.168.31.185:100 S
2024-04-21T17:23:11.246770,134.123.104.109,192.168.31.185,28879,100,242,icmp,malicious,28,IP / ICMP 134.123.104.109 > 192.168.31.185 echo-request 0
2024-04-21T17:23:11.253751,118.229.157.79,192.168.31.185,19580,100,818,syn,malicious,40,IP / TCP 118.229.157.79:19580 > 192.168.31.185:100 S
2024-04-21T17:23:11.259735,12.240.200.155,192.168.31.185,41004,100,160,syn,malicious,40,IP / TCP 12.240.200.155:41004 > 192.168.31.185:100 S
2024-04-21T17:23:11.265719,185.161.170.42,192.168.31.185,52234,100,155,syn,malicious,40,IP / TCP 185.161.170.42:52234 > 192.168.31.185:100 S
2024-04-21T17:23:11.270705,173.112.237.233,192.168.31.185,26929,100,964,udp,malicious,28,IP / UDP 173.112.237.233:26929 > 192.168.31.185:100
2024-04-21T17:23:11.274694,59.172.16.178,192.168.31.185,50942,100,556,udp,malicious,28,IP / UDP 59.172.16.178:50942 > 192.168.31.185:100
2024-04-21T17:23:11.279681,13.118.133.243,192.168.31.185,47997,100,280,icmp,malicious,28,IP / ICMP 13.118.133.243 > 192.168.31.185 echo-request 0
2024-04-21T17:23:11.284668,23.206.128.230,192.168.31.185,2940,100,834,udp,malicious,28,IP / UDP 23.206.128.230:2940 > 192.168.31.185:100
2024-04-21T17:23:11.289655,17.9.25.91,192.168.31.185,56481,100,1225,icmp,malicious,28,IP / ICMP 17.9.25.91 > 192.168.31.185 echo-request 0
2024-04-21T17:23:11.294642,191.165.45.136,192.168.31.185,13543,100,814,syn,malicious,40,IP / TCP 191.165.45.136:13543 > 192.168.31.185:100 S
2024-04-21T17:23:11.300625,211.107.84.185,192.168.31.185,30329,100,992,syn,malicious,40,IP / TCP 211.107.84.185:30329 > 192.168.31.185:100 S
2024-04-21T17:23:11.305612,157.227.19.24,192.168.31.185,20052,100,1214,syn,malicious,40,IP / TCP 157.227.19.24:20052 > 192.168.31.185:100 S
2024-04-21T17:23:11.310598,82.205.50.78,192.168.31.185,44710,100,234,udp,malicious,28,IP / UDP 82.205.50.78:44710 > 192.168.31.185:100
2024-04-21T17:23:11.315585,111.96.105.70,192.168.31.185,1531,100,1085,syn,malicious,40,IP / TCP 111.96.105.70:1531 > 192.168.31.185:100 S
